SCIP version 7.0.2 [precision: 8 byte] [memory: block] [mode: optimized] [LP solver: SoPlex 5.0.2] [GitHash: dafb536cfd]
Copyright (C) 2002-2020 Konrad-Zuse-Zentrum fuer Informationstechnik Berlin (ZIB)

External codes: 
  Readline 7.0         GNU library for command line editing (gnu.org/s/readline)
  SoPlex 5.0.2         Linear Programming Solver developed at Zuse Institute Berlin (soplex.zib.de) [GitHash: 3623dbc0]
  CppAD 20180000.0     Algorithmic Differentiation of C++ algorithms developed by B. Bell (www.coin-or.org/CppAD)
  ZLIB 1.2.11          General purpose compression library by J. Gailly and M. Adler (zlib.net)
  GMP 6.1.2            GNU Multiple Precision Arithmetic Library developed by T. Granlund (gmplib.org)
  ZIMPL 3.4.0          Zuse Institute Mathematical Programming Language developed by T. Koch (zimpl.zib.de)
  PaPILO 1.0.1         parallel presolve for integer and linear optimization (https://github.com/lgottwald/PaPILO) [GitHash: 0638fc4]
  bliss 0.73p          Computing Graph Automorphism Groups by T. Junttila and P. Kaski (http://www.tcs.hut.fi/Software/bliss/)
  Ipopt 3.13.2         Interior Point Optimizer developed by A. Waechter et.al. (www.coin-or.org/Ipopt)

user parameter file <scip.set> not found - using default parameters

read problem <model_strategy_1eng.zpl>
============


base directory for ZIMPL parsing: </workspace>

original problem has 36893 variables (42 bin, 0 int, 0 impl, 36851 cont) and 53140 constraints

solve problem
=============

presolving:
(round 1, fast)       20127 del vars, 22824 del conss, 0 add conss, 27623 chg bounds, 0 chg sides, 0 chg coeffs, 0 upgd conss, 0 impls, 0 clqs
(round 2, fast)       36508 del vars, 52460 del conss, 0 add conss, 44153 chg bounds, 2 chg sides, 13 chg coeffs, 0 upgd conss, 0 impls, 0 clqs
(round 3, fast)       36523 del vars, 52706 del conss, 0 add conss, 44167 chg bounds, 2 chg sides, 13 chg coeffs, 0 upgd conss, 0 impls, 0 clqs
(round 4, fast)       36525 del vars, 52708 del conss, 0 add conss, 44196 chg bounds, 8 chg sides, 15 chg coeffs, 0 upgd conss, 0 impls, 0 clqs
(round 5, fast)       36528 del vars, 52708 del conss, 0 add conss, 44223 chg bounds, 10 chg sides, 20 chg coeffs, 0 upgd conss, 0 impls, 0 clqs
(round 6, fast)       36528 del vars, 52708 del conss, 0 add conss, 44235 chg bounds, 13 chg sides, 23 chg coeffs, 0 upgd conss, 0 impls, 0 clqs
(round 7, fast)       36528 del vars, 52708 del conss, 0 add conss, 44240 chg bounds, 13 chg sides, 24 chg coeffs, 0 upgd conss, 0 impls, 0 clqs
(round 8, fast)       36528 del vars, 52708 del conss, 0 add conss, 44244 chg bounds, 13 chg sides, 27 chg coeffs, 0 upgd conss, 0 impls, 0 clqs
   (0.4s) running MILP presolver
   (0.4s) MILP presolver (7 rounds): 121 aggregations, 20 fixings, 0 bound changes
(round 9, medium)     36669 del vars, 53140 del conss, 195 add conss, 44245 chg bounds, 13 chg sides, 28 chg coeffs, 0 upgd conss, 0 impls, 0 clqs
(round 10, fast)       36679 del vars, 53140 del conss, 195 add conss, 44245 chg bounds, 13 chg sides, 28 chg coeffs, 0 upgd conss, 0 impls, 0 clqs
(round 11, fast)       36679 del vars, 53140 del conss, 195 add conss, 44245 chg bounds, 23 chg sides, 28 chg coeffs, 0 upgd conss, 0 impls, 0 clqs
(round 12, exhaustive) 36679 del vars, 53234 del conss, 195 add conss, 44245 chg bounds, 117 chg sides, 28 chg coeffs, 0 upgd conss, 0 impls, 0 clqs
(round 13, fast)       36684 del vars, 53234 del conss, 195 add conss, 44245 chg bounds, 117 chg sides, 28 chg coeffs, 0 upgd conss, 0 impls, 0 clqs
(round 14, fast)       36684 del vars, 53234 del conss, 195 add conss, 44245 chg bounds, 122 chg sides, 28 chg coeffs, 0 upgd conss, 0 impls, 0 clqs
(round 15, fast)       36686 del vars, 53234 del conss, 195 add conss, 44245 chg bounds, 122 chg sides, 28 chg coeffs, 0 upgd conss, 0 impls, 0 clqs
   (0.4s) running MILP presolver
   (0.4s) MILP presolver (10 rounds): 29 aggregations, 32 fixings, 10 bound changes
(round 16, medium)     36747 del vars, 53234 del conss, 195 add conss, 44255 chg bounds, 122 chg sides, 28 chg coeffs, 0 upgd conss, 0 impls, 0 clqs
(round 17, fast)       36747 del vars, 53264 del conss, 195 add conss, 44255 chg bounds, 122 chg sides, 33 chg coeffs, 0 upgd conss, 0 impls, 0 clqs
(round 18, exhaustive) 36749 del vars, 53264 del conss, 195 add conss, 44255 chg bounds, 122 chg sides, 33 chg coeffs, 0 upgd conss, 0 impls, 0 clqs
   (0.4s) probing cycle finished: starting next cycle
   (0.4s) symmetry computation started: requiring (bin +, int -, cont +), (fixed: bin -, int +, cont -)
   (0.4s) symmetry computation finished: 1 generators found (max: 1500, log10 of symmetry group size: 0.3)
   (0.4s) no symmetry on binary variables present.
presolving (19 rounds: 19 fast, 5 medium, 3 exhaustive):
 36749 deleted vars, 53264 deleted constraints, 195 added constraints, 44255 tightened bounds, 0 added holes, 122 changed sides, 33 changed coefficients
 100 implications, 0 cliques
presolved problem has 144 variables (27 bin, 0 int, 0 impl, 117 cont) and 71 constraints
     71 constraints of type <linear>
Presolving Time: 0.33

 time | node  | left  |LP iter|LP it/n|mem/heur|mdpt |vars |cons |rows |cuts |sepa|confs|strbr|  dualbound   | primalbound  |  gap   | compl. 
p 0.5s|     1 |     0 |    37 |     - |   locks|   0 | 144 |  71 |  71 |   0 |  0 |   0 |   0 | 7.852242e+06 | 3.334912e+05 |2254.56%| unknown
  0.5s|     1 |     0 |    68 |     - |   138M |   0 | 144 |  71 |  71 |   0 |  0 |   0 |   0 | 4.081457e+05 | 3.334912e+05 |  22.39%| unknown
  0.5s|     1 |     0 |    76 |     - |   138M |   0 | 144 |  71 |  76 |   5 |  1 |   0 |   0 | 3.995937e+05 | 3.334912e+05 |  19.82%| unknown
  0.5s|     1 |     0 |    80 |     - |   138M |   0 | 144 |  71 |  78 |   7 |  3 |   0 |   0 | 3.974226e+05 | 3.334912e+05 |  19.17%| unknown
  0.5s|     1 |     0 |    81 |     - |   138M |   0 | 144 |  71 |  79 |   8 |  5 |   0 |   0 | 3.968515e+05 | 3.334912e+05 |  19.00%| unknown
* 0.5s|     1 |     0 |    81 |     - |    LP  |   0 | 144 |  71 |  79 |   8 |  7 |   0 |   0 | 3.968515e+05 | 3.968515e+05 |   0.00%| unknown

SCIP Status        : problem is solved [optimal solution found]
Solving Time (sec) : 0.52
Solving Nodes      : 1
Primal Bound       : +3.96851507212170e+05 (3 solutions)
Dual Bound         : +3.96851507212170e+05
Gap                : 0.00 %

primal solution (original space):
=================================

objective value:                      396851.50721217
s#1                                                 1 	(obj:-3660)
s#13                                                1 	(obj:-3660)
s#25                                                1 	(obj:-3660)
s#37                                                1 	(obj:-3660)
s#39                                                1 	(obj:-3660)
x#1#18#2                                           52 	(obj:-20.3834863654341)
x#1#19#2                                           53 	(obj:-21.3707218504201)
x#1#61#3                                          587 	(obj:-4.62235649546828)
x#2#9#2                                           127 	(obj:-12.0356028862058)
x#2#20#2                                           53 	(obj:-22.3724957052615)
x#2#62#3                                          587 	(obj:-4.62235649546828)
x#3#10#2                                          127 	(obj:-12.9288727928426)
x#3#21#2                                           53 	(obj:-23.3833806341359)
x#3#63#3                                          587 	(obj:-4.62235649546828)
x#4#11#2                                          127 	(obj:-13.8306429939341)
x#4#22#2                                           53 	(obj:-17.5214575150235)
x#4#64#3                                          587 	(obj:-4.62235649546828)
x#5#12#3                                          127 	(obj:0)
x#5#23#2                                           53 	(obj:-17.5214575150235)
x#5#65#3                                          587 	(obj:-4.62235649546828)
x#6#13#3                                          127 	(obj:-4.62235649546828)
x#6#24#2                                           53 	(obj:-17.5214575150235)
x#6#66#3                                          587 	(obj:-4.62235649546828)
x#7#0#1                                        252.41 	(obj:-45.9802844510504)
x#7#0#2                                        252.41 	(obj:-45.9802844510504)
x#7#14#3                                          127 	(obj:-4.62235649546828)
x#7#25#2                                           53 	(obj:-17.5214575150235)
x#7#67#3                                          587 	(obj:-4.62235649546828)
x#8#1#1                                        252.41 	(obj:-5.24254779799416)
x#8#1#2                                        252.41 	(obj:-5.24254779799416)
x#8#15#3                                          127 	(obj:-4.62235649546828)
x#8#26#2                                           53 	(obj:-17.5214575150235)
x#8#68#3                                          587 	(obj:-4.62235649546828)
x#9#2#1                                        252.41 	(obj:-6.05421092486207)
x#9#2#2                                        252.41 	(obj:-6.05421092486207)
x#9#16#3                                          127 	(obj:-4.62235649546828)
x#9#27#2                                           53 	(obj:-17.5214575150235)
x#9#69#3                                          587 	(obj:-4.62235649546828)
x#10#3#1                                       252.41 	(obj:-6.87550949817744)
x#10#3#2                                       252.41 	(obj:-6.87550949817744)
x#10#17#3                                         127 	(obj:-4.62235649546828)
x#10#28#2                                          53 	(obj:-17.5214575150235)
x#10#70#3                                         587 	(obj:-4.62235649546828)
x#11#4#1                                       252.41 	(obj:-7.70746468295299)
x#11#4#2                                       252.41 	(obj:-7.70746468295299)
x#11#18#3                                         127 	(obj:-4.62235649546828)
x#11#29#2                                          53 	(obj:-17.5214575150235)
x#11#71#3                                         587 	(obj:-4.62235649546828)
x#12#5#1                                       252.41 	(obj:-8.55109764420144)
x#12#5#2                                       252.41 	(obj:-8.55109764420144)
x#12#19#3                                         127 	(obj:-4.62235649546828)
x#12#30#2                                          53 	(obj:-17.5214575150235)
x#12#72#3                                         587 	(obj:-4.62235649546828)
x#13#6#1                                       252.41 	(obj:-9.4074295469355)
x#13#6#2                                       252.41 	(obj:-9.4074295469355)
x#13#20#3                                         127 	(obj:-4.62235649546828)
x#13#31#2                                          53 	(obj:-17.5214575150235)
x#13#73#3                                         587 	(obj:-4.62235649546828)
x#14#7#2                                       252.41 	(obj:-10.2748178018611)
x#14#21#3                                         127 	(obj:-4.62235649546828)
x#14#74#3                                         587 	(obj:-4.62235649546828)
x#15#8#2                                       252.41 	(obj:-11.150896735415)
x#15#22#3                                         127 	(obj:-4.62235649546828)
x#15#75#3                                         587 	(obj:-4.62235649546828)
x#16#9#2                                       252.41 	(obj:-12.0356028862058)
x#16#23#3                                         127 	(obj:-4.62235649546828)
x#16#76#3                                         587 	(obj:-4.62235649546828)
x#17#10#2                                      252.41 	(obj:-12.9288727928426)
x#17#24#3                                         127 	(obj:-4.62235649546828)
x#17#77#3                                         587 	(obj:-4.62235649546828)
x#18#11#2                                      252.41 	(obj:-13.8306429939341)
x#18#25#3                                         127 	(obj:-4.62235649546828)
x#18#78#3                                         587 	(obj:-4.62235649546828)
x#19#0#1                                       307.02 	(obj:-45.9802844510504)
x#19#0#2                                       307.02 	(obj:-45.9802844510504)
x#19#12#2                                      252.41 	(obj:-14.7408500280891)
x#19#26#3                                         127 	(obj:-4.62235649546828)
x#19#79#3                                         587 	(obj:-4.62235649546828)
x#20#1#1                                       307.02 	(obj:-5.24254779799416)
x#20#1#2                                       307.02 	(obj:-5.24254779799416)
x#20#13#2                                      252.41 	(obj:-15.6594304339164)
x#20#27#3                                         127 	(obj:-4.62235649546828)
x#20#80#3                                         587 	(obj:-4.62235649546828)
x#21#2#1                                       307.02 	(obj:-6.05421092486207)
x#21#2#2                                       307.02 	(obj:-6.05421092486207)
x#21#14#2                                      252.41 	(obj:-16.5863207500249)
x#21#28#3                                         127 	(obj:-4.62235649546828)
x#21#81#3                                         587 	(obj:-4.62235649546828)
x#22#3#1                                       307.02 	(obj:-6.87550949817744)
x#22#3#2                                       307.02 	(obj:-6.87550949817744)
x#22#15#2                                      252.41 	(obj:-17.5214575150235)
x#22#29#3                                         127 	(obj:-4.62235649546828)
x#22#82#3                                         587 	(obj:-4.62235649546828)
x#23#4#1                                       307.02 	(obj:-7.70746468295299)
x#23#4#2                                       307.02 	(obj:-7.70746468295299)
x#23#16#2                                      252.41 	(obj:-18.4647772675209)
x#23#30#3                                         127 	(obj:-4.62235649546828)
x#23#83#3                                         587 	(obj:-4.62235649546828)
x#24#5#1                                       307.02 	(obj:-8.55109764420144)
x#24#5#2                                       307.02 	(obj:-8.55109764420144)
x#24#17#2                                      252.41 	(obj:-19.4162165461259)
x#24#31#3                                         127 	(obj:-4.62235649546828)
x#24#84#3                                         587 	(obj:-4.62235649546828)
x#25#6#1                                       307.02 	(obj:-9.4074295469355)
x#25#6#2                                       307.02 	(obj:-9.4074295469355)
x#25#18#2                                      252.41 	(obj:-20.3834863654341)
x#25#32#3                                         127 	(obj:-4.62235649546828)
x#25#85#3                                         587 	(obj:-4.62235649546828)
x#26#7#2                                       307.02 	(obj:-10.2748178018611)
x#26#33#3                                         127 	(obj:-4.62235649546828)
x#26#86#3                                         587 	(obj:-4.62235649546828)
x#27#8#2                                       307.02 	(obj:-11.150896735415)
x#27#34#3                                         127 	(obj:-4.62235649546828)
x#27#87#3                                         587 	(obj:-4.62235649546828)
x#28#9#2                                       307.02 	(obj:-12.0356028862058)
x#28#35#3                                         127 	(obj:-4.62235649546828)
x#28#88#3                                         587 	(obj:-4.62235649546828)
x#29#10#2                                      307.02 	(obj:-12.9288727928426)
x#29#36#3                                         127 	(obj:-4.62235649546828)
x#29#89#3                                         587 	(obj:-4.62235649546828)
x#30#11#2                                      307.02 	(obj:-13.8306429939341)
x#30#37#3                                         127 	(obj:-4.62235649546828)
x#30#90#3                                         587 	(obj:-4.62235649546828)
x#31#0#1                                       307.02 	(obj:-45.9802844510504)
x#31#0#2                                       307.02 	(obj:-45.9802844510504)
x#31#12#2                                      307.02 	(obj:-14.7408500280891)
x#31#38#3                                         127 	(obj:-4.62235649546828)
x#31#91#3                                         587 	(obj:-4.62235649546828)
x#32#1#1                                       307.02 	(obj:-5.24254779799416)
x#32#1#2                                       307.02 	(obj:-5.24254779799416)
x#32#13#2                                      307.02 	(obj:-15.6594304339164)
x#32#92#3                                         587 	(obj:-4.62235649546828)
x#33#2#1                                       307.02 	(obj:-6.05421092486207)
x#33#2#2                                       307.02 	(obj:-6.05421092486207)
x#33#14#2                                      307.02 	(obj:-16.5863207500249)
x#33#93#3                                         587 	(obj:-4.62235649546828)
x#34#3#1                                       307.02 	(obj:-6.87550949817744)
x#34#3#2                                       307.02 	(obj:-6.87550949817744)
x#34#15#2                                      307.02 	(obj:-17.5214575150235)
x#34#94#3                                         587 	(obj:-4.62235649546828)
x#35#4#1                                       307.02 	(obj:-7.70746468295299)
x#35#4#2                                       307.02 	(obj:-7.70746468295299)
x#35#16#2                                      307.02 	(obj:-18.4647772675209)
x#35#95#3                                         587 	(obj:-4.62235649546828)
x#36#5#1                                       307.02 	(obj:-8.55109764420144)
x#36#5#2                                       307.02 	(obj:-8.55109764420144)
x#36#17#2                                      307.02 	(obj:-19.4162165461259)
x#36#96#3                                         587 	(obj:-4.62235649546828)
x#37#6#1                                       307.02 	(obj:-9.4074295469355)
x#37#6#2                                       307.02 	(obj:-9.4074295469355)
x#37#18#2                                      307.02 	(obj:-20.3834863654341)
x#37#97#3                                         587 	(obj:-4.62235649546828)
x#38#7#1                                       307.02 	(obj:-10.2748178018611)
x#38#7#2                                       307.02 	(obj:-10.2748178018611)
x#38#98#3                                         587 	(obj:-4.62235649546828)
x#39#8#1                                       307.02 	(obj:-11.150896735415)
x#39#8#2                                       307.02 	(obj:-11.150896735415)
x#39#99#3                                         587 	(obj:-4.62235649546828)
x#40#100#3                                        587 	(obj:-4.62235649546828)
x#41#101#3                                        587 	(obj:-4.62235649546828)
x#42#102#3                                        587 	(obj:-4.62235649546828)
x#0#6#1                                           157 	(obj:0)
x#0#6#2                                           132 	(obj:0)
x#0#7#1                                           135 	(obj:0)
x#0#7#2                                           127 	(obj:0)
x#0#17#2                                           52 	(obj:0)
x#0#18#2                                           53 	(obj:0)
x#0#60#3                                          587 	(obj:0)
y#1#7#1                                           157 	(obj:348)
y#1#7#2                                           132 	(obj:348)
y#1#8#1                                           135 	(obj:348)
y#1#18#2                                           52 	(obj:650)
y#13#6#1                                       252.41 	(obj:249)
y#13#31#2                                          53 	(obj:542)
y#25#6#1                                       307.02 	(obj:242)
y#25#18#2                                      252.41 	(obj:450)
y#31#38#3                                         127 	(obj:157)
y#37#18#2                                      307.02 	(obj:507)
y#39#8#1                                       307.02 	(obj:332)
y#39#8#2                                       307.02 	(obj:332)
w#4#11                                            127 	(obj:0)
n#7#1                                          252.41 	(obj:0)
n#7#2                                          252.41 	(obj:0)
n#19#1                                         307.02 	(obj:0)
n#19#2                                         307.02 	(obj:0)
n#31#1                                         307.02 	(obj:0)
n#31#2                                         307.02 	(obj:0)
x#1#7#1                                           157 	(obj:-10.2748178018611)
x#1#7#2                                           132 	(obj:-10.2748178018611)
x#1#8#1                                           135 	(obj:-11.150896735415)
x#1#8#2                                           127 	(obj:-11.150896735415)

Statistics
==========

SCIP Status        : problem is solved [optimal solution found]
Total Time         :       1.37
  solving          :       0.52
  presolving       :       0.33 (included in solving)
  reading          :       0.85
  copying          :       0.01 (1 #copies) (minimal 0.01, maximal 0.01, average 0.01)
Original Problem   :
  Problem name     : model_strategy_1eng.zpl
  Variables        : 36893 (42 binary, 0 integer, 0 implicit integer, 36851 continuous)
  Constraints      : 53140 initial, 53140 maximal
  Objective        : maximize, 19035 non-zeros (abs.min = 4.62236, abs.max = 3660)
Presolved Problem  :
  Problem name     : t_model_strategy_1eng.zpl
  Variables        : 144 (27 binary, 0 integer, 0 implicit integer, 117 continuous)
  Constraints      : 71 initial, 71 maximal
  Objective        : minimize, 144 non-zeros (abs.min = 2.87365, abs.max = 3660)
  Nonzeros         : 411 constraint, 0 clique table
Presolvers         :   ExecTime  SetupTime  Calls  FixedVars   AggrVars   ChgTypes  ChgBounds   AddHoles    DelCons    AddCons   ChgSides   ChgCoefs
  boundshift       :       0.00       0.00      0          0          0          0          0          0          0          0          0          0
  convertinttobin  :       0.00       0.00      0          0          0          0          0          0          0          0          0          0
  domcol           :       0.00       0.00      2          2          0          0          0          0          0          0          0          0
  dualagg          :       0.00       0.00      0          0          0          0          0          0          0          0          0          0
  dualcomp         :       0.00       0.00      2          0          0          0          0          0          0          0          0          0
  dualinfer        :       0.00       0.00      0          0          0          0          0          0          0          0          0          0
  dualsparsify     :       0.00       0.00      1          0          0          0          0          0          0          0          0          0
  gateextraction   :       0.00       0.00      0          0          0          0          0          0          0          0          0          0
  implics          :       0.00       0.00      5          0          0          0          0          0          0          0          0          0
  inttobinary      :       0.00       0.00      0          0          0          0          0          0          0          0          0          0
  milp             :       0.04       0.00      2         52        150          0         10          0        432        195          0          0
  qpkktref         :       0.00       0.00      0          0          0          0          0          0          0          0          0          0
  redvub           :       0.00       0.00      0          0          0          0          0          0          0          0          0          0
  sparsify         :       0.00       0.00      1          0          0          0          0          0          0          0          0          0
  stuffing         :       0.00       0.00      0          0          0          0          0          0          0          0          0          0
  trivial          :       0.00       0.00     19          0          0          0          0          0          0          0          0          0
  tworowbnd        :       0.00       0.00      0          0          0          0          0          0          0          0          0          0
  dualfix          :       0.01       0.00     19          8          0          0          0          0          0          0          0          0
  genvbounds       :       0.00       0.00      0          0          0          0          0          0          0          0          0          0
  probing          :       0.01       0.00      1          0          0          0          0          0          0          0          0          0
  pseudoobj        :       0.00       0.00      0          0          0          0          0          0          0          0          0          0
  symmetry         :       0.01       0.00      1          0          0          0          0          0          0          0          0          0
  vbounds          :       0.00       0.00      0          0          0          0          0          0          0          0          0          0
  linear           :       0.16       0.02     22      33431       3106          0      44245          0      52832          0        122         33
  benders          :       0.00       0.00      0          0          0          0          0          0          0          0          0          0
  components       :       0.00       0.00      1          0          0          0          0          0          0          0          0          0
  root node        :          -          -      -          0          -          -          0          -          -          -          -          -
Constraints        :     Number  MaxNumber  #Separate #Propagate    #EnfoLP    #EnfoRelax  #EnfoPS    #Check   #ResProp    Cutoffs    DomReds       Cuts    Applied      Conss   Children
  benderslp        :          0          0          0          0          1          0          0         15          0          0          0          0          0          0          0
  integral         :          0          0          0          0          1          0          0         15          0          0          0          0          0          0          0
  linear           :         71         71          4        129          1          0          0          9          0          0          0          0          0          0          0
  benders          :          0          0          0          0          1          0          0          3          0          0          0          0          0          0          0
  countsols        :          0          0          0          0          1          0          0          3          0          0          0          0          0          0          0
  components       :          0          0          0          0          0          0          0          0          0          0          0          0          0          0          0
Constraint Timings :  TotalTime  SetupTime   Separate  Propagate     EnfoLP     EnfoPS     EnfoRelax   Check    ResProp    SB-Prop
  benderslp        :       0.00       0.00       0.00       0.00       0.00       0.00       0.00       0.00       0.00       0.00
  integral         :       0.00       0.00       0.00       0.00       0.00       0.00       0.00       0.00       0.00       0.00
  linear           :       0.02       0.02       0.00       0.00       0.00       0.00       0.00       0.00       0.00       0.00
  benders          :       0.00       0.00       0.00       0.00       0.00       0.00       0.00       0.00       0.00       0.00
  countsols        :       0.00       0.00       0.00       0.00       0.00       0.00       0.00       0.00       0.00       0.00
  components       :       0.00       0.00       0.00       0.00       0.00       0.00       0.00       0.00       0.00       0.00
Propagators        : #Propagate   #ResProp    Cutoffs    DomReds
  dualfix          :          2          0          0          0
  genvbounds       :          0          0          0          0
  nlobbt           :          0          0          0          0
  obbt             :          0          0          0          0
  probing          :          0          0          0          0
  pseudoobj        :          7          0          0          0
  redcost          :          5          0          0          0
  rootredcost      :          0          0          0          0
  symmetry         :          0          0          0          0
  vbounds          :         49          0          0          0
Propagator Timings :  TotalTime  SetupTime   Presolve  Propagate    ResProp    SB-Prop
  dualfix          :       0.01       0.00       0.01       0.00       0.00       0.00
  genvbounds       :       0.00       0.00       0.00       0.00       0.00       0.00
  nlobbt           :       0.00       0.00       0.00       0.00       0.00       0.00
  obbt             :       0.00       0.00       0.00       0.00       0.00       0.00
  probing          :       0.01       0.00       0.01       0.00       0.00       0.00
  pseudoobj        :       0.00       0.00       0.00       0.00       0.00       0.00
  redcost          :       0.00       0.00       0.00       0.00       0.00       0.00
  rootredcost      :       0.00       0.00       0.00       0.00       0.00       0.00
  symmetry         :       0.01       0.00       0.01       0.00       0.00       0.00
  vbounds          :       0.00       0.00       0.00       0.00       0.00       0.00
Conflict Analysis  :       Time      Calls    Success    DomReds  Conflicts   Literals    Reconvs ReconvLits   Dualrays   Nonzeros   LP Iters   (pool size: [--,--])
  propagation      :       0.00          0          0          -          0        0.0          0        0.0          -          -          -
  infeasible LP    :       0.00          0          0          -          0        0.0          0        0.0          0        0.0          0
  bound exceed. LP :       0.00          0          0          -          0        0.0          0        0.0          0        0.0          0
  strong branching :       0.00          0          0          -          0        0.0          0        0.0          -          -          0
  pseudo solution  :       0.00          0          0          -          0        0.0          0        0.0          -          -          -
  applied globally :       0.00          -          -          0          0        0.0          -          -          0          -          -
  applied locally  :          -          -          -          0          0        0.0          -          -          0          -          -
Separators         :   ExecTime  SetupTime      Calls    Cutoffs    DomReds       Cuts    Applied      Conss
  cut pool         :       0.00                     8          -          -         17          -          -    (maximal pool size: 23)
  aggregation      :       0.01       0.00          3          0          0          8          0          0
  cgmip            :       0.00       0.00          0          0          0          0          0          0
  clique           :       0.00       0.00          1          0          0          0          0          0
  closecuts        :       0.00       0.00          0          0          0          0          0          0
  cmir             :       0.00       0.00          0          0          0          0          1          0
  convexproj       :       0.00       0.00          0          0          0          0          0          0
  disjunctive      :       0.00       0.00          0          0          0          0          0          0
  eccuts           :       0.00       0.00          0          0          0          0          0          0
  flowcover        :       0.00       0.00          0          0          0          0          0          0
  gauge            :       0.00       0.00          0          0          0          0          0          0
  gomory           :       0.00       0.00          3          0          0          5          2          0
  impliedbounds    :       0.00       0.00          3          0          0         10          5          0
  intobj           :       0.00       0.00          0          0          0          0          0          0
  mcf              :       0.00       0.00          1          0          0          0          0          0
  oddcycle         :       0.00       0.00          0          0          0          0          0          0
  rapidlearning    :       0.00       0.00          0          0          0          0          0          0
  strongcg         :       0.00       0.00          3          0          0          0          0          0
  zerohalf         :       0.00       0.00          3          0          0          0          0          0
Pricers            :   ExecTime  SetupTime      Calls       Vars
  problem variables:       0.00          -          0          0
Branching Rules    :   ExecTime  SetupTime   BranchLP  BranchExt   BranchPS    Cutoffs    DomReds       Cuts      Conss   Children
  allfullstrong    :       0.00       0.00          0          0          0          0          0          0          0          0
  cloud            :       0.00       0.00          0          0          0          0          0          0          0          0
  distribution     :       0.00       0.00          0          0          0          0          0          0          0          0
  fullstrong       :       0.00       0.00          0          0          0          0          0          0          0          0
  inference        :       0.00       0.00          0          0          0          0          0          0          0          0
  leastinf         :       0.00       0.00          0          0          0          0          0          0          0          0
  lookahead        :       0.00       0.00          0          0          0          0          0          0          0          0
  mostinf          :       0.00       0.00          0          0          0          0          0          0          0          0
  multaggr         :       0.00       0.00          0          0          0          0          0          0          0          0
  nodereopt        :       0.00       0.00          0          0          0          0          0          0          0          0
  pscost           :       0.00       0.00          0          0          0          0          0          0          0          0
  random           :       0.00       0.00          0          0          0          0          0          0          0          0
  relpscost        :       0.00       0.00          0          0          0          0          0          0          0          0
  vanillafullstrong:       0.00       0.00          0          0          0          0          0          0          0          0
Primal Heuristics  :   ExecTime  SetupTime      Calls      Found       Best
  LP solutions     :       0.00          -          -          1          1
  relax solutions  :       0.00          -          -          0          0
  pseudo solutions :       0.00          -          -          0          0
  strong branching :       0.00          -          -          0          0
  actconsdiving    :       0.00       0.00          0          0          0
  adaptivediving   :       0.00       0.00          0          0          0
  alns             :       0.02       0.00          1          0          0
  bound            :       0.00       0.00          0          0          0
  clique           :       0.00       0.00          0          0          0
  coefdiving       :       0.00       0.00          0          0          0
  completesol      :       0.00       0.00          0          0          0
  conflictdiving   :       0.00       0.00          0          0          0
  crossover        :       0.00       0.00          0          0          0
  dins             :       0.00       0.00          0          0          0
  distributiondivin:       0.00       0.00          0          0          0
  dualval          :       0.00       0.00          0          0          0
  farkasdiving     :       0.00       0.00          0          0          0
  feaspump         :       0.00       0.00          0          0          0
  fixandinfer      :       0.00       0.00          0          0          0
  fracdiving       :       0.00       0.00          0          0          0
  gins             :       0.00       0.00          0          0          0
  guideddiving     :       0.00       0.00          0          0          0
  indicator        :       0.00       0.00          0          0          0
  intdiving        :       0.00       0.00          0          0          0
  intshifting      :       0.00       0.00          0          0          0
  linesearchdiving :       0.00       0.00          0          0          0
  localbranching   :       0.00       0.00          0          0          0
  locks            :       0.02       0.00          1          1          1
  lpface           :       0.00       0.00          0          0          0
  mpec             :       0.00       0.00          0          0          0
  multistart       :       0.00       0.00          0          0          0
  mutation         :       0.00       0.00          0          0          0
  nlpdiving        :       0.00       0.00          0          0          0
  objpscostdiving  :       0.00       0.00          0          0          0
  octane           :       0.00       0.00          0          0          0
  ofins            :       0.00       0.00          0          0          0
  oneopt           :       0.00       0.00          1          0          0
  padm             :       0.00       0.00          0          0          0
  proximity        :       0.00       0.00          0          0          0
  pscostdiving     :       0.00       0.00          0          0          0
  randrounding     :       0.00       0.00          3          0          0
  rens             :       0.00       0.00          0          0          0
  reoptsols        :       0.00       0.00          0          0          0
  repair           :       0.00       0.00          0          0          0
  rins             :       0.00       0.00          0          0          0
  rootsoldiving    :       0.00       0.00          0          0          0
  rounding         :       0.00       0.00          3          0          0
  shiftandpropagate:       0.00       0.00          0          0          0
  shifting         :       0.00       0.00          3          1          0
  simplerounding   :       0.00       0.00          0          0          0
  subnlp           :       0.00       0.00          0          0          0
  trivial          :       0.07       0.00          2          0          0
  trivialnegation  :       0.00       0.00          0          0          0
  trustregion      :       0.00       0.00          0          0          0
  trysol           :       0.00       0.00          0          0          0
  twoopt           :       0.00       0.00          0          0          0
  undercover       :       0.00       0.00          0          0          0
  vbounds          :       0.00       0.00          0          0          0
  veclendiving     :       0.00       0.00          0          0          0
  zeroobj          :       0.00       0.00          0          0          0
  zirounding       :       0.00       0.00          0          0          0
  other solutions  :          -          -          -          0          -
Diving (single)    :      Calls      Nodes   LP Iters Backtracks  Conflicts   MinDepth   MaxDepth   AvgDepth  RoundSols  NLeafSols  MinSolDpt  MaxSolDpt  AvgSolDpt
  actconsdiving    :          0          -          -          -          -          -          -          -          -          -          -          -          -
  coefdiving       :          0          -          -          -          -          -          -          -          -          -          -          -          -
  conflictdiving   :          0          -          -          -          -          -          -          -          -          -          -          -          -
  distributiondivin:          0          -          -          -          -          -          -          -          -          -          -          -          -
  farkasdiving     :          0          -          -          -          -          -          -          -          -          -          -          -          -
  fracdiving       :          0          -          -          -          -          -          -          -          -          -          -          -          -
  guideddiving     :          0          -          -          -          -          -          -          -          -          -          -          -          -
  linesearchdiving :          0          -          -          -          -          -          -          -          -          -          -          -          -
  pscostdiving     :          0          -          -          -          -          -          -          -          -          -          -          -          -
  veclendiving     :          0          -          -          -          -          -          -          -          -          -          -          -          -
Diving (adaptive)  :      Calls      Nodes   LP Iters Backtracks  Conflicts   MinDepth   MaxDepth   AvgDepth  RoundSols  NLeafSols  MinSolDpt  MaxSolDpt  AvgSolDpt
  actconsdiving    :          0          -          -          -          -          -          -          -          -          -          -          -          -
  coefdiving       :          0          -          -          -          -          -          -          -          -          -          -          -          -
  conflictdiving   :          0          -          -          -          -          -          -          -          -          -          -          -          -
  distributiondivin:          0          -          -          -          -          -          -          -          -          -          -          -          -
  farkasdiving     :          0          -          -          -          -          -          -          -          -          -          -          -          -
  fracdiving       :          0          -          -          -          -          -          -          -          -          -          -          -          -
  guideddiving     :          0          -          -          -          -          -          -          -          -          -          -          -          -
  linesearchdiving :          0          -          -          -          -          -          -          -          -          -          -          -          -
  pscostdiving     :          0          -          -          -          -          -          -          -          -          -          -          -          -
  veclendiving     :          0          -          -          -          -          -          -          -          -          -          -          -          -
Neighborhoods      :      Calls  SetupTime  SolveTime SolveNodes       Sols       Best       Exp3  EpsGreedy        UCB TgtFixRate  Opt  Inf Node Stal  Sol  Usr Othr Actv
  rens             :          0       0.00       0.00          0          0          0    0.00000   -1.00000    1.00000      0.900    0    0    0    0    0    0    0    1
  rins             :          0       0.00       0.00          0          0          0    0.00000   -1.00000    1.00000      0.900    0    0    0    0    0    0    0    1
  mutation         :          0       0.00       0.00          0          0          0    0.00000   -1.00000    1.00000      0.900    0    0    0    0    0    0    0    1
  localbranching   :          0       0.00       0.00          0          0          0    0.00000   -1.00000    1.00000      0.900    0    0    0    0    0    0    0    1
  crossover        :          1       0.01       0.00          0          0          0    0.00000   -1.00000    1.00000      0.900    0    0    0    0    0    0    1    1
  proximity        :          0       0.00       0.00          0          0          0    0.00000   -1.00000    1.00000      0.900    0    0    0    0    0    0    0    1
  zeroobjective    :          0       0.00       0.00          0          0          0    0.00000   -1.00000    1.00000      0.900    0    0    0    0    0    0    0    1
  dins             :          0       0.00       0.00          0          0          0    0.00000   -1.00000    1.00000      0.900    0    0    0    0    0    0    0    1
  trustregion      :          0       0.00       0.00          0          0          0    0.00000   -1.00000    1.00000      0.900    0    0    0    0    0    0    0    0
LP                 :       Time      Calls Iterations  Iter/call   Iter/sec  Time-0-It Calls-0-It    ItLimit
  primal LP        :       0.00          0          0       0.00          -       0.00          0
  dual LP          :       0.00          4         44      11.00          -       0.00          0
  lex dual LP      :       0.00          0          0       0.00          -
  barrier LP       :       0.00          0          0       0.00          -       0.00          0
  resolve instable :       0.00          0          0       0.00          -
  diving/probing LP:       0.01          1         37      37.00    3388.59
  strong branching :       0.00          0          0       0.00          -          -          -          0
    (at root node) :          -          0          0       0.00          -
  conflict analysis:       0.00          0          0       0.00          -
B&B Tree           :
  number of runs   :          1
  nodes            :          1 (0 internal, 1 leaves)
  feasible leaves  :          1
  infeas. leaves   :          0
  objective leaves :          0
  nodes (total)    :          1 (0 internal, 1 leaves)
  nodes left       :          0
  max depth        :          0
  max depth (total):          0
  backtracks       :          0 (0.0%)
  early backtracks :          0 (0.0%)
  nodes exc. ref.  :          0 (0.0%)
  delayed cutoffs  :          0
  repropagations   :          0 (0 domain reductions, 0 cutoffs)
  avg switch length:       2.00
  switching time   :       0.00
Estim. Tree Size   :          1
Estimation Tree    : 1 nodes (1 visited, 0 internal, 1 leaves, 0 open), weight: 1.0000 completed 1.0000
Estimations        :      estim      value      trend resolution     smooth
  wbe              :          1          -          -          -          -
  tree-profile     :         -1          -          -          -          -
  gap              :          1    1.00000    1.00000          1          1
  tree-weight      :          1    1.00000    1.00000          1          1
  leaf-frequency   :          1    0.50000    1.00000          1          1
  ssg              :          1    0.00000   -1.00000          1          1
  open-nodes       :          1    0.00000    0.00000          1          1
Root Node          :
  First LP value   : +4.08145674160948e+05
  First LP Iters   :         31 (26632.30 Iter/sec)
  First LP Time    :       0.00
  Final Dual Bound : +3.96851507212170e+05
  Final Root Iters :         44
  Root LP Estimate : +3.96851507212170e+05
Solution           :
  Solutions found  :          3 (2 improvements)
  First Solution   : +3.33491206715543e+05   (in run 1, after 1 nodes, 0.46 seconds, depth 28, found by <locks>)
  Gap First Sol.   :    2254.56 %
  Gap Last Sol.    :       0.00 %
  Primal Bound     : +3.96851507212170e+05   (in run 1, after 1 nodes, 0.52 seconds, depth 0, found by <relaxation>)
  Dual Bound       : +3.96851507212170e+05
  Gap              :       0.00 %
Integrals          :      Total       Avg%
  primal-dual      :      47.66      91.76
  primal-ref       :          -          - (not evaluated)
  dual-ref         :          -          - (not evaluated)
