SCIP version 7.0.2 [precision: 8 byte] [memory: block] [mode: optimized] [LP solver: SoPlex 5.0.2] [GitHash: dafb536cfd]
Copyright (C) 2002-2020 Konrad-Zuse-Zentrum fuer Informationstechnik Berlin (ZIB)

External codes: 
  Readline 7.0         GNU library for command line editing (gnu.org/s/readline)
  SoPlex 5.0.2         Linear Programming Solver developed at Zuse Institute Berlin (soplex.zib.de) [GitHash: 3623dbc0]
  CppAD 20180000.0     Algorithmic Differentiation of C++ algorithms developed by B. Bell (www.coin-or.org/CppAD)
  ZLIB 1.2.11          General purpose compression library by J. Gailly and M. Adler (zlib.net)
  GMP 6.1.2            GNU Multiple Precision Arithmetic Library developed by T. Granlund (gmplib.org)
  ZIMPL 3.4.0          Zuse Institute Mathematical Programming Language developed by T. Koch (zimpl.zib.de)
  PaPILO 1.0.1         parallel presolve for integer and linear optimization (https://github.com/lgottwald/PaPILO) [GitHash: 0638fc4]
  bliss 0.73p          Computing Graph Automorphism Groups by T. Junttila and P. Kaski (http://www.tcs.hut.fi/Software/bliss/)
  Ipopt 3.13.2         Interior Point Optimizer developed by A. Waechter et.al. (www.coin-or.org/Ipopt)

user parameter file <scip.set> not found - using default parameters

read problem <model_strategy_2eng.zpl>
============


base directory for ZIMPL parsing: </workspace>

original problem has 31817 variables (108 bin, 0 int, 0 impl, 31709 cont) and 45802 constraints

solve problem
=============

presolving:
(round 1, fast)       17603 del vars, 19860 del conss, 0 add conss, 23930 chg bounds, 0 chg sides, 0 chg coeffs, 0 upgd conss, 0 impls, 0 clqs
(round 2, fast)       31511 del vars, 45243 del conss, 0 add conss, 38247 chg bounds, 2 chg sides, 13 chg coeffs, 0 upgd conss, 0 impls, 0 clqs
(round 3, fast)       31527 del vars, 45453 del conss, 0 add conss, 38269 chg bounds, 2 chg sides, 14 chg coeffs, 0 upgd conss, 0 impls, 0 clqs
(round 4, fast)       31527 del vars, 45453 del conss, 0 add conss, 38281 chg bounds, 11 chg sides, 18 chg coeffs, 0 upgd conss, 0 impls, 0 clqs
(round 5, fast)       31527 del vars, 45453 del conss, 0 add conss, 38293 chg bounds, 11 chg sides, 20 chg coeffs, 0 upgd conss, 0 impls, 0 clqs
(round 6, fast)       31527 del vars, 45453 del conss, 0 add conss, 38300 chg bounds, 11 chg sides, 22 chg coeffs, 0 upgd conss, 0 impls, 0 clqs
(round 7, exhaustive) 31527 del vars, 45622 del conss, 0 add conss, 38300 chg bounds, 125 chg sides, 22 chg coeffs, 0 upgd conss, 0 impls, 0 clqs
(round 8, fast)       31586 del vars, 45622 del conss, 0 add conss, 38300 chg bounds, 125 chg sides, 22 chg coeffs, 0 upgd conss, 0 impls, 0 clqs
(round 9, fast)       31608 del vars, 45644 del conss, 0 add conss, 38300 chg bounds, 184 chg sides, 22 chg coeffs, 0 upgd conss, 0 impls, 0 clqs
(round 10, fast)       31636 del vars, 45672 del conss, 0 add conss, 38300 chg bounds, 184 chg sides, 22 chg coeffs, 0 upgd conss, 0 impls, 0 clqs
(round 11, exhaustive) 31636 del vars, 45672 del conss, 0 add conss, 38300 chg bounds, 184 chg sides, 22 chg coeffs, 1 upgd conss, 0 impls, 0 clqs
(round 12, exhaustive) 31636 del vars, 45672 del conss, 0 add conss, 38300 chg bounds, 184 chg sides, 22 chg coeffs, 2 upgd conss, 1 impls, 0 clqs
   (0.3s) probing cycle finished: starting next cycle
(round 13, exhaustive) 31641 del vars, 45672 del conss, 0 add conss, 38330 chg bounds, 184 chg sides, 22 chg coeffs, 2 upgd conss, 94 impls, 0 clqs
(round 14, fast)       31643 del vars, 45676 del conss, 0 add conss, 38339 chg bounds, 184 chg sides, 30 chg coeffs, 8 upgd conss, 94 impls, 0 clqs
(round 15, fast)       31648 del vars, 45681 del conss, 0 add conss, 38339 chg bounds, 184 chg sides, 38 chg coeffs, 8 upgd conss, 94 impls, 0 clqs
   (0.3s) probing cycle finished: starting next cycle
(round 16, exhaustive) 31648 del vars, 45681 del conss, 0 add conss, 38339 chg bounds, 184 chg sides, 46 chg coeffs, 8 upgd conss, 98 impls, 0 clqs
(round 17, fast)       31649 del vars, 45682 del conss, 0 add conss, 38344 chg bounds, 184 chg sides, 46 chg coeffs, 8 upgd conss, 98 impls, 0 clqs
(round 18, fast)       31650 del vars, 45683 del conss, 0 add conss, 38351 chg bounds, 184 chg sides, 46 chg coeffs, 8 upgd conss, 98 impls, 0 clqs
(round 19, fast)       31650 del vars, 45683 del conss, 0 add conss, 38358 chg bounds, 184 chg sides, 46 chg coeffs, 8 upgd conss, 98 impls, 0 clqs
   (0.3s) probing cycle finished: starting next cycle
   (0.3s) symmetry computation started: requiring (bin +, int -, cont +), (fixed: bin -, int +, cont -)
   (0.3s) no symmetry present
presolving (20 rounds: 20 fast, 6 medium, 6 exhaustive):
 31650 deleted vars, 45683 deleted constraints, 0 added constraints, 38358 tightened bounds, 0 added holes, 184 changed sides, 46 changed coefficients
 98 implications, 0 cliques
presolved problem has 167 variables (21 bin, 0 int, 0 impl, 146 cont) and 119 constraints
      2 constraints of type <varbound>
    117 constraints of type <linear>
Presolving Time: 0.22

 time | node  | left  |LP iter|LP it/n|mem/heur|mdpt |vars |cons |rows |cuts |sepa|confs|strbr|  dualbound   | primalbound  |  gap   | compl. 
p 0.3s|     1 |     0 |   111 |     - |   locks|   0 | 167 | 119 | 119 |   0 |  0 |   0 |   0 | 4.427018e+06 | 1.664457e+05 |2559.74%| unknown
  0.3s|     1 |     0 |   262 |     - |   123M |   0 | 167 | 119 | 119 |   0 |  0 |   0 |   0 | 2.249582e+05 | 1.664457e+05 |  35.15%| unknown
  0.4s|     1 |     0 |   265 |     - |   123M |   0 | 167 | 119 | 121 |   2 |  1 |   0 |   0 | 2.227694e+05 | 1.664457e+05 |  33.84%| unknown
  0.4s|     1 |     0 |   266 |     - |   123M |   0 | 167 | 119 | 123 |   4 |  2 |   0 |   0 | 2.217819e+05 | 1.664457e+05 |  33.25%| unknown
r 0.4s|     1 |     0 |   266 |     - |randroun|   0 | 167 | 119 | 123 |   0 |  2 |   0 |   0 | 2.217819e+05 | 2.213509e+05 |   0.19%| unknown
  0.4s|     1 |     0 |   267 |     - |   124M |   0 | 167 | 113 | 123 |   4 |  4 |   0 |   0 | 2.213509e+05 | 2.213509e+05 |   0.00%| unknown
  0.4s|     1 |     0 |   267 |     - |   124M |   0 | 167 | 113 | 123 |   4 |  4 |   0 |   0 | 2.213509e+05 | 2.213509e+05 |   0.00%| unknown

SCIP Status        : problem is solved [optimal solution found]
Solving Time (sec) : 0.37
Solving Nodes      : 1
Primal Bound       : +2.21350901052457e+05 (3 solutions)
Dual Bound         : +2.21350901052457e+05
Gap                : 0.00 %

primal solution (original space):
=================================

objective value:                     221350.901052508
s#1                                                 1 	(obj:-3660)
s#13                                                1 	(obj:-3660)
s#25                                                1 	(obj:-3660)
s#35                                                1 	(obj:-3660)
k#7                                                 1 	(obj:0)
k#19                                                1 	(obj:0)
l#7                                                 1 	(obj:0)
l#19                                                1 	(obj:0)
x#1#61#3                                          587 	(obj:-4.62235649546828)
x#2#20#2                                           54 	(obj:-22.3724957052615)
x#2#62#3                             587.000000000355 	(obj:-4.62235649546828)
x#3#21#2                                           54 	(obj:-23.3833806341359)
x#3#63#3                             587.000000000355 	(obj:-4.62235649546828)
x#4#22#2                                           54 	(obj:-17.5214575150235)
x#4#64#3                             587.000000000355 	(obj:-4.62235649546828)
x#5#23#2                                           54 	(obj:-17.5214575150235)
x#5#65#3                             587.000000000355 	(obj:-4.62235649546828)
x#6#24#2                                           54 	(obj:-17.5214575150235)
x#6#66#3                             587.000000000355 	(obj:-4.62235649546828)
x#7#0#1                              252.410000000153 	(obj:-45.9802844510504)
x#7#0#2                              252.410000000153 	(obj:-45.9802844510504)
x#7#25#2                                           54 	(obj:-17.5214575150235)
x#7#67#3                             587.000000000355 	(obj:-4.62235649546828)
x#8#1#1                              252.410000000153 	(obj:-5.24254779799416)
x#8#1#2                              252.410000000153 	(obj:-5.24254779799416)
x#8#26#2                                           54 	(obj:-17.5214575150235)
x#8#68#3                             587.000000000355 	(obj:-4.62235649546828)
x#9#2#1                              252.410000000153 	(obj:-6.05421092486207)
x#9#2#2                              252.410000000153 	(obj:-6.05421092486207)
x#9#27#2                                           54 	(obj:-17.5214575150235)
x#9#69#3                             587.000000000355 	(obj:-4.62235649546828)
x#10#3#1                             252.410000000153 	(obj:-6.87550949817744)
x#10#3#2                             252.410000000153 	(obj:-6.87550949817744)
x#10#28#2                                          54 	(obj:-17.5214575150235)
x#10#70#3                            587.000000000355 	(obj:-4.62235649546828)
x#11#4#1                             252.410000000153 	(obj:-7.70746468295299)
x#11#4#2                             252.410000000153 	(obj:-7.70746468295299)
x#11#29#2                                          54 	(obj:-17.5214575150235)
x#11#71#3                            587.000000000355 	(obj:-4.62235649546828)
x#12#5#1                             252.410000000153 	(obj:-8.55109764420144)
x#12#5#2                             252.410000000153 	(obj:-8.55109764420144)
x#12#30#2                                          54 	(obj:-17.5214575150235)
x#12#72#3                            587.000000000355 	(obj:-4.62235649546828)
x#13#6#1                             252.410000000153 	(obj:-9.4074295469355)
x#13#6#2                             252.410000000153 	(obj:-9.4074295469355)
x#13#31#2                                          54 	(obj:-17.5214575150235)
x#13#73#3                            587.000000000355 	(obj:-4.62235649546828)
x#14#7#2                             176.687000000107 	(obj:-10.2748178018611)
x#14#74#3                            587.000000000355 	(obj:-4.62235649546828)
x#15#8#2                             176.687000000107 	(obj:-11.150896735415)
x#15#75#3                            587.000000000355 	(obj:-4.62235649546828)
x#16#9#2                             176.687000000107 	(obj:-12.0356028862058)
x#16#76#3                            587.000000000355 	(obj:-4.62235649546828)
x#17#10#2                            176.687000000107 	(obj:-12.9288727928426)
x#17#77#3                            587.000000000355 	(obj:-4.62235649546828)
x#18#11#2                            176.687000000107 	(obj:-13.8306429939341)
x#18#78#3                            587.000000000355 	(obj:-4.62235649546828)
x#19#0#1                             252.410000000153 	(obj:-45.9802844510504)
x#19#0#2                             252.410000000153 	(obj:-45.9802844510504)
x#19#12#2                            75.7230000000457 	(obj:-14.7408500280891)
x#19#12#3                            100.964000000061 	(obj:0)
x#19#79#3                            587.000000000355 	(obj:-4.62235649546828)
x#20#1#1                             252.410000000153 	(obj:-5.24254779799416)
x#20#1#2                             252.410000000153 	(obj:-5.24254779799416)
x#20#13#2                            75.7230000000457 	(obj:-15.6594304339164)
x#20#13#3                            100.964000000061 	(obj:-4.62235649546828)
x#20#80#3                            587.000000000355 	(obj:-4.62235649546828)
x#21#2#1                             252.410000000153 	(obj:-6.05421092486207)
x#21#2#2                             252.410000000153 	(obj:-6.05421092486207)
x#21#14#2                            75.7230000000457 	(obj:-16.5863207500249)
x#21#14#3                            100.964000000061 	(obj:-4.62235649546828)
x#21#81#3                            587.000000000355 	(obj:-4.62235649546828)
x#22#3#1                             252.410000000153 	(obj:-6.87550949817744)
x#22#3#2                             252.410000000153 	(obj:-6.87550949817744)
x#22#15#2                            75.7230000000457 	(obj:-17.5214575150235)
x#22#15#3                            100.964000000061 	(obj:-4.62235649546828)
x#22#82#3                            587.000000000355 	(obj:-4.62235649546828)
x#23#4#1                             252.410000000153 	(obj:-7.70746468295299)
x#23#4#2                             252.410000000153 	(obj:-7.70746468295299)
x#23#16#2                            75.7230000000457 	(obj:-18.4647772675209)
x#23#16#3                            100.964000000061 	(obj:-4.62235649546828)
x#23#83#3                            587.000000000355 	(obj:-4.62235649546828)
x#24#5#1                             252.410000000153 	(obj:-8.55109764420144)
x#24#5#2                             252.410000000153 	(obj:-8.55109764420144)
x#24#17#2                            75.7230000000457 	(obj:-19.4162165461259)
x#24#17#3                            100.964000000061 	(obj:-4.62235649546828)
x#24#84#3                            587.000000000355 	(obj:-4.62235649546828)
x#25#6#1                             252.410000000153 	(obj:-9.4074295469355)
x#25#6#2                             252.410000000153 	(obj:-9.4074295469355)
x#25#18#2                            75.7230000010458 	(obj:-20.3834863654341)
x#25#18#3                            100.964000000061 	(obj:-4.62235649546828)
x#25#85#3                            385.071999999878 	(obj:-4.62235649546828)
x#26#7#2                             176.687000000107 	(obj:-10.2748178018611)
x#26#19#3                            100.964000000061 	(obj:-4.62235649546828)
x#26#86#3                            385.071999999878 	(obj:-4.62235649546828)
x#27#8#2                             176.687000000107 	(obj:-11.150896735415)
x#27#20#3                            100.964000000061 	(obj:-4.62235649546828)
x#27#87#3                            385.071999999878 	(obj:-4.62235649546828)
x#28#9#2                             176.687000000107 	(obj:-12.0356028862058)
x#28#21#3                            100.964000000061 	(obj:-4.62235649546828)
x#28#88#3                            385.071999999878 	(obj:-4.62235649546828)
x#29#10#2                            176.687000000107 	(obj:-12.9288727928426)
x#29#22#3                            100.964000000061 	(obj:-4.62235649546828)
x#29#89#3                            385.071999999878 	(obj:-4.62235649546828)
x#30#11#2                            176.687000000107 	(obj:-13.8306429939341)
x#30#23#3                            100.964000000061 	(obj:-4.62235649546828)
x#30#90#3                            385.071999999878 	(obj:-4.62235649546828)
x#31#0#1                             208.995479999974 	(obj:-45.9802844510504)
x#31#0#2                             208.995479999974 	(obj:-45.9802844510504)
x#31#12#2                            75.7230000000458 	(obj:-14.7408500280891)
x#31#12#3                            100.964000000061 	(obj:0)
x#31#24#3                            100.964000000061 	(obj:-4.62235649546828)
x#31#91#3                            385.071999999878 	(obj:-4.62235649546828)
x#32#1#1                             208.995479999974 	(obj:-5.24254779799416)
x#32#1#2                             208.995479999974 	(obj:-5.24254779799416)
x#32#13#2                            75.7230000000458 	(obj:-15.6594304339164)
x#32#13#3                            100.964000000061 	(obj:-4.62235649546828)
x#32#25#3                            100.964000000061 	(obj:-4.62235649546828)
x#32#92#3                            385.071999999878 	(obj:-4.62235649546828)
x#33#2#1                             208.995479999974 	(obj:-6.05421092486207)
x#33#2#2                             208.995479999974 	(obj:-6.05421092486207)
x#33#14#2                            75.7230000000458 	(obj:-16.5863207500249)
x#33#14#3                            100.964000000061 	(obj:-4.62235649546828)
x#33#26#3                            100.964000000061 	(obj:-4.62235649546828)
x#33#93#3                            385.071999999878 	(obj:-4.62235649546828)
x#34#3#1                             208.995479999974 	(obj:-6.87550949817744)
x#34#3#2                             208.995479999974 	(obj:-6.87550949817744)
x#34#15#2                            75.7230000000458 	(obj:-17.5214575150235)
x#34#15#3                            100.964000000061 	(obj:-4.62235649546828)
x#34#27#3                            100.964000000061 	(obj:-4.62235649546828)
x#34#94#3                            385.071999999878 	(obj:-4.62235649546828)
x#35#4#1                             208.995479999974 	(obj:-7.70746468295299)
x#35#4#2                             208.995479999974 	(obj:-7.70746468295299)
x#35#16#2                            75.7230000000458 	(obj:-18.4647772675209)
x#35#16#3                            100.964000000061 	(obj:-4.62235649546828)
x#35#28#3                            100.964000000061 	(obj:-4.62235649546828)
x#35#95#3                            385.071999999878 	(obj:-4.62235649546828)
x#36#5#1                             208.995479999974 	(obj:-8.55109764420144)
x#36#5#2                             208.995479999974 	(obj:-8.55109764420144)
x#36#17#3                            100.964000000061 	(obj:-4.62235649546828)
x#36#29#3                            100.964000000061 	(obj:-4.62235649546828)
x#36#96#3                            385.071999999878 	(obj:-4.62235649546828)
x#0#6#1                                           147 	(obj:0)
x#0#6#2                                           129 	(obj:0)
x#0#7#1                                           145 	(obj:0)
x#0#7#2                                           130 	(obj:0)
x#0#17#2                                           51 	(obj:0)
x#0#18#2                                           54 	(obj:0)
x#0#60#3                                          587 	(obj:0)
y#1#7#1                                           147 	(obj:348)
y#1#7#2                                           129 	(obj:348)
y#1#8#1                                           145 	(obj:348)
y#1#8#2                                           130 	(obj:348)
y#1#18#2                                           51 	(obj:650)
y#13#6#1                             252.410000000153 	(obj:249)
y#13#6#2                             75.7230000000457 	(obj:249)
y#13#31#2                                          54 	(obj:542)
y#24#17#2                        -1.00001784630877e-09 	(obj:403)
y#24#84#3                            201.928000000477 	(obj:157)
y#25#6#1                             252.410000000153 	(obj:242)
y#25#6#2                             75.7230000000458 	(obj:242)
y#25#18#2                            75.7230000010458 	(obj:450)
y#35#16#2                            75.7230000000458 	(obj:434)
w#18#11                              100.964000000061 	(obj:0)
w#30#11                              100.964000000061 	(obj:0)
n#7#1                                252.410000000153 	(obj:0)
n#7#2                                252.410000000153 	(obj:0)
n#19#1                               252.410000000153 	(obj:0)
n#19#2                               252.410000000153 	(obj:0)
n#31#1                               208.995479999974 	(obj:0)
n#31#2                               208.995479999974 	(obj:0)
x#1#7#1                                           147 	(obj:-10.2748178018611)
x#1#7#2                                           129 	(obj:-10.2748178018611)
x#1#8#1                                           145 	(obj:-11.150896735415)
x#1#8#2                                           130 	(obj:-11.150896735415)
x#1#18#2                                           51 	(obj:-20.3834863654341)
x#1#19#2                                           54 	(obj:-21.3707218504201)

Statistics
==========

SCIP Status        : problem is solved [optimal solution found]
Total Time         :       1.02
  solving          :       0.37
  presolving       :       0.22 (included in solving)
  reading          :       0.65
  copying          :       0.00 (0 times copied the problem)
Original Problem   :
  Problem name     : model_strategy_2eng.zpl
  Variables        : 31817 (108 binary, 0 integer, 0 implicit integer, 31709 continuous)
  Constraints      : 45802 initial, 45802 maximal
  Objective        : maximize, 16191 non-zeros (abs.min = 4.62236, abs.max = 3660)
Presolved Problem  :
  Problem name     : t_model_strategy_2eng.zpl
  Variables        : 167 (21 binary, 0 integer, 0 implicit integer, 146 continuous)
  Constraints      : 119 initial, 119 maximal
  Objective        : minimize, 167 non-zeros (abs.min = 10.2748, abs.max = 3660)
  Nonzeros         : 431 constraint, 0 clique table
Presolvers         :   ExecTime  SetupTime  Calls  FixedVars   AggrVars   ChgTypes  ChgBounds   AddHoles    DelCons    AddCons   ChgSides   ChgCoefs
  boundshift       :       0.00       0.00      0          0          0          0          0          0          0          0          0          0
  convertinttobin  :       0.00       0.00      0          0          0          0          0          0          0          0          0          0
  domcol           :       0.00       0.00      3          0          0          0          0          0          0          0          0          0
  dualagg          :       0.00       0.00      0          0          0          0          0          0          0          0          0          0
  dualcomp         :       0.00       0.00      3          0          0          0          0          0          0          0          0          0
  dualinfer        :       0.00       0.00      0          0          0          0          0          0          0          0          0          0
  dualsparsify     :       0.00       0.00      2          0          0          0          0          0          0          0          0          8
  gateextraction   :       0.00       0.00      0          0          0          0          0          0          0          0          0          0
  implics          :       0.00       0.00      6          0          0          0          0          0          0          0          0          0
  inttobinary      :       0.00       0.00      0          0          0          0          0          0          0          0          0          0
  milp             :       0.00       0.00      0          0          0          0          0          0          0          0          0          0
  qpkktref         :       0.00       0.00      0          0          0          0          0          0          0          0          0          0
  redvub           :       0.00       0.00      0          0          0          0          0          0          0          0          0          0
  sparsify         :       0.00       0.00      1          0          0          0          0          0          0          0          0          0
  stuffing         :       0.00       0.00      0          0          0          0          0          0          0          0          0          0
  trivial          :       0.00       0.00     20          0          0          0          0          0          0          0          0          0
  tworowbnd        :       0.00       0.00      0          0          0          0          0          0          0          0          0          0
  dualfix          :       0.00       0.00     20         75          0          0          0          0          0          0          0          0
  genvbounds       :       0.00       0.00      0          0          0          0          0          0          0          0          0          0
  probing          :       0.01       0.00      3          5          0          0         30          0          0          0          0          0
  pseudoobj        :       0.00       0.00      0          0          0          0          0          0          0          0          0          0
  symmetry         :       0.00       0.00      1          0          0          0          0          0          0          0          0          0
  vbounds          :       0.00       0.00      0          0          0          0          0          0          0          0          0          0
  varbound         :       0.00       0.00     13          0          0          0          0          0          0          0          0          0
  linear           :       0.12       0.02     26      28780       2790          0      38316          0      45683          0        184         38
  quadratic        :       0.00       0.00     19          0          0          0         12          0          0          0          0          0
  benders          :       0.00       0.00      0          0          0          0          0          0          0          0          0          0
  components       :       0.00       0.00      1          0          0          0          0          0          0          0          0          0
  root node        :          -          -      -          3          -          -         18          -          -          -          -          -
Constraints        :     Number  MaxNumber  #Separate #Propagate    #EnfoLP    #EnfoRelax  #EnfoPS    #Check   #ResProp    Cutoffs    DomReds       Cuts    Applied      Conss   Children
  benderslp        :          0          0          0          0          0          0          0         14          0          0          0          0          0          0          0
  integral         :          0          0          0          0          0          0          0         14          0          0          0          0          0          0          0
  varbound         :          2          2          3        223          0          0          0          8          0          0          0          0          0          0          0
  linear           :        117        117          3        244          0          0          0          7          0          2         16          0          0          0          0
  benders          :          0          0          0          0          0          0          0          4          0          0          0          0          0          0          0
  countsols        :          0          0          0          0          0          0          0          4          0          0          0          0          0          0          0
  components       :          0          0          0          0          0          0          0          0          0          0          0          0          0          0          0
Constraint Timings :  TotalTime  SetupTime   Separate  Propagate     EnfoLP     EnfoPS     EnfoRelax   Check    ResProp    SB-Prop
  benderslp        :       0.00       0.00       0.00       0.00       0.00       0.00       0.00       0.00       0.00       0.00
  integral         :       0.00       0.00       0.00       0.00       0.00       0.00       0.00       0.00       0.00       0.00
  varbound         :       0.00       0.00       0.00       0.00       0.00       0.00       0.00       0.00       0.00       0.00
  linear           :       0.02       0.02       0.00       0.00       0.00       0.00       0.00       0.00       0.00       0.00
  benders          :       0.00       0.00       0.00       0.00       0.00       0.00       0.00       0.00       0.00       0.00
  countsols        :       0.00       0.00       0.00       0.00       0.00       0.00       0.00       0.00       0.00       0.00
  components       :       0.00       0.00       0.00       0.00       0.00       0.00       0.00       0.00       0.00       0.00
Propagators        : #Propagate   #ResProp    Cutoffs    DomReds
  dualfix          :         11          0          0          0
  genvbounds       :          0          0          0          0
  nlobbt           :          0          0          0          0
  obbt             :          0          0          0          0
  probing          :          0          0          0          0
  pseudoobj        :         16          0          0          0
  redcost          :          4          0          0          2
  rootredcost      :          0          0          0          0
  symmetry         :          0          0          0          0
  vbounds          :         48          0          0          0
Propagator Timings :  TotalTime  SetupTime   Presolve  Propagate    ResProp    SB-Prop
  dualfix          :       0.00       0.00       0.00       0.00       0.00       0.00
  genvbounds       :       0.00       0.00       0.00       0.00       0.00       0.00
  nlobbt           :       0.00       0.00       0.00       0.00       0.00       0.00
  obbt             :       0.00       0.00       0.00       0.00       0.00       0.00
  probing          :       0.01       0.00       0.01       0.00       0.00       0.00
  pseudoobj        :       0.00       0.00       0.00       0.00       0.00       0.00
  redcost          :       0.00       0.00       0.00       0.00       0.00       0.00
  rootredcost      :       0.00       0.00       0.00       0.00       0.00       0.00
  symmetry         :       0.00       0.00       0.00       0.00       0.00       0.00
  vbounds          :       0.00       0.00       0.00       0.00       0.00       0.00
Conflict Analysis  :       Time      Calls    Success    DomReds  Conflicts   Literals    Reconvs ReconvLits   Dualrays   Nonzeros   LP Iters   (pool size: [--,--])
  propagation      :       0.00          0          0          -          0        0.0          0        0.0          -          -          -
  infeasible LP    :       0.00          0          0          -          0        0.0          0        0.0          0        0.0          0
  bound exceed. LP :       0.00          0          0          -          0        0.0          0        0.0          0        0.0          0
  strong branching :       0.00          0          0          -          0        0.0          0        0.0          -          -          0
  pseudo solution  :       0.00          0          0          -          0        0.0          0        0.0          -          -          -
  applied globally :       0.00          -          -          0          0        0.0          -          -          0          -          -
  applied locally  :          -          -          -          0          0        0.0          -          -          0          -          -
Separators         :   ExecTime  SetupTime      Calls    Cutoffs    DomReds       Cuts    Applied      Conss
  cut pool         :       0.00                     5          -          -          9          -          -    (maximal pool size: 29)
  aggregation      :       0.01       0.00          3          0          0         11          0          0
  cgmip            :       0.00       0.00          0          0          0          0          0          0
  clique           :       0.00       0.00          1          0          0          0          0          0
  closecuts        :       0.00       0.00          0          0          0          0          0          0
  cmir             :       0.00       0.00          0          0          0          0          0          0
  convexproj       :       0.00       0.00          0          0          0          0          0          0
  disjunctive      :       0.00       0.00          0          0          0          0          0          0
  eccuts           :       0.00       0.00          0          0          0          0          0          0
  flowcover        :       0.00       0.00          0          0          0          0          0          0
  gauge            :       0.00       0.00          0          0          0          0          0          0
  gomory           :       0.00       0.00          3          0          0          5          1          0
  impliedbounds    :       0.00       0.00          3          0          0         11          3          0
  intobj           :       0.00       0.00          0          0          0          0          0          0
  mcf              :       0.00       0.00          1          0          0          0          0          0
  oddcycle         :       0.00       0.00          0          0          0          0          0          0
  rapidlearning    :       0.00       0.00          0          0          0          0          0          0
  strongcg         :       0.00       0.00          3          0          0          0          0          0
  zerohalf         :       0.00       0.00          3          0          0          2          0          0
Pricers            :   ExecTime  SetupTime      Calls       Vars
  problem variables:       0.00          -          0          0
Branching Rules    :   ExecTime  SetupTime   BranchLP  BranchExt   BranchPS    Cutoffs    DomReds       Cuts      Conss   Children
  allfullstrong    :       0.00       0.00          0          0          0          0          0          0          0          0
  cloud            :       0.00       0.00          0          0          0          0          0          0          0          0
  distribution     :       0.00       0.00          0          0          0          0          0          0          0          0
  fullstrong       :       0.00       0.00          0          0          0          0          0          0          0          0
  inference        :       0.00       0.00          0          0          0          0          0          0          0          0
  leastinf         :       0.00       0.00          0          0          0          0          0          0          0          0
  lookahead        :       0.00       0.00          0          0          0          0          0          0          0          0
  mostinf          :       0.00       0.00          0          0          0          0          0          0          0          0
  multaggr         :       0.00       0.00          0          0          0          0          0          0          0          0
  nodereopt        :       0.00       0.00          0          0          0          0          0          0          0          0
  pscost           :       0.00       0.00          0          0          0          0          0          0          0          0
  random           :       0.00       0.00          0          0          0          0          0          0          0          0
  relpscost        :       0.00       0.00          0          0          0          0          0          0          0          0
  vanillafullstrong:       0.00       0.00          0          0          0          0          0          0          0          0
Primal Heuristics  :   ExecTime  SetupTime      Calls      Found       Best
  LP solutions     :       0.00          -          -          0          0
  relax solutions  :       0.00          -          -          0          0
  pseudo solutions :       0.00          -          -          0          0
  strong branching :       0.00          -          -          0          0
  actconsdiving    :       0.00       0.00          0          0          0
  adaptivediving   :       0.00       0.00          0          0          0
  alns             :       0.00       0.00          0          0          0
  bound            :       0.00       0.00          0          0          0
  clique           :       0.00       0.00          0          0          0
  coefdiving       :       0.00       0.00          0          0          0
  completesol      :       0.00       0.00          0          0          0
  conflictdiving   :       0.00       0.00          0          0          0
  crossover        :       0.00       0.00          0          0          0
  dins             :       0.00       0.00          0          0          0
  distributiondivin:       0.00       0.00          0          0          0
  dualval          :       0.00       0.00          0          0          0
  farkasdiving     :       0.00       0.00          0          0          0
  feaspump         :       0.00       0.00          0          0          0
  fixandinfer      :       0.00       0.00          0          0          0
  fracdiving       :       0.00       0.00          0          0          0
  gins             :       0.00       0.00          0          0          0
  guideddiving     :       0.00       0.00          0          0          0
  indicator        :       0.00       0.00          0          0          0
  intdiving        :       0.00       0.00          0          0          0
  intshifting      :       0.00       0.00          0          0          0
  linesearchdiving :       0.00       0.00          0          0          0
  localbranching   :       0.00       0.00          0          0          0
  locks            :       0.02       0.00          1          1          1
  lpface           :       0.00       0.00          0          0          0
  mpec             :       0.00       0.00          0          0          0
  multistart       :       0.00       0.00          0          0          0
  mutation         :       0.00       0.00          0          0          0
  nlpdiving        :       0.00       0.00          0          0          0
  objpscostdiving  :       0.00       0.00          0          0          0
  octane           :       0.00       0.00          0          0          0
  ofins            :       0.00       0.00          0          0          0
  oneopt           :       0.00       0.00          1          0          0
  padm             :       0.00       0.00          0          0          0
  proximity        :       0.00       0.00          0          0          0
  pscostdiving     :       0.00       0.00          0          0          0
  randrounding     :       0.00       0.00          3          1          1
  rens             :       0.00       0.00          0          0          0
  reoptsols        :       0.00       0.00          0          0          0
  repair           :       0.00       0.00          0          0          0
  rins             :       0.00       0.00          0          0          0
  rootsoldiving    :       0.00       0.00          0          0          0
  rounding         :       0.00       0.00          3          0          0
  shiftandpropagate:       0.00       0.00          0          0          0
  shifting         :       0.00       0.00          3          1          0
  simplerounding   :       0.00       0.00          0          0          0
  subnlp           :       0.00       0.00          0          0          0
  trivial          :       0.05       0.00          2          0          0
  trivialnegation  :       0.00       0.00          0          0          0
  trustregion      :       0.00       0.00          0          0          0
  trysol           :       0.00       0.00          0          0          0
  twoopt           :       0.00       0.00          0          0          0
  undercover       :       0.00       0.00          0          0          0
  vbounds          :       0.00       0.00          0          0          0
  veclendiving     :       0.00       0.00          0          0          0
  zeroobj          :       0.00       0.00          0          0          0
  zirounding       :       0.00       0.00          0          0          0
  other solutions  :          -          -          -          0          -
Diving (single)    :      Calls      Nodes   LP Iters Backtracks  Conflicts   MinDepth   MaxDepth   AvgDepth  RoundSols  NLeafSols  MinSolDpt  MaxSolDpt  AvgSolDpt
  actconsdiving    :          0          -          -          -          -          -          -          -          -          -          -          -          -
  coefdiving       :          0          -          -          -          -          -          -          -          -          -          -          -          -
  conflictdiving   :          0          -          -          -          -          -          -          -          -          -          -          -          -
  distributiondivin:          0          -          -          -          -          -          -          -          -          -          -          -          -
  farkasdiving     :          0          -          -          -          -          -          -          -          -          -          -          -          -
  fracdiving       :          0          -          -          -          -          -          -          -          -          -          -          -          -
  guideddiving     :          0          -          -          -          -          -          -          -          -          -          -          -          -
  linesearchdiving :          0          -          -          -          -          -          -          -          -          -          -          -          -
  pscostdiving     :          0          -          -          -          -          -          -          -          -          -          -          -          -
  veclendiving     :          0          -          -          -          -          -          -          -          -          -          -          -          -
Diving (adaptive)  :      Calls      Nodes   LP Iters Backtracks  Conflicts   MinDepth   MaxDepth   AvgDepth  RoundSols  NLeafSols  MinSolDpt  MaxSolDpt  AvgSolDpt
  actconsdiving    :          0          -          -          -          -          -          -          -          -          -          -          -          -
  coefdiving       :          0          -          -          -          -          -          -          -          -          -          -          -          -
  conflictdiving   :          0          -          -          -          -          -          -          -          -          -          -          -          -
  distributiondivin:          0          -          -          -          -          -          -          -          -          -          -          -          -
  farkasdiving     :          0          -          -          -          -          -          -          -          -          -          -          -          -
  fracdiving       :          0          -          -          -          -          -          -          -          -          -          -          -          -
  guideddiving     :          0          -          -          -          -          -          -          -          -          -          -          -          -
  linesearchdiving :          0          -          -          -          -          -          -          -          -          -          -          -          -
  pscostdiving     :          0          -          -          -          -          -          -          -          -          -          -          -          -
  veclendiving     :          0          -          -          -          -          -          -          -          -          -          -          -          -
Neighborhoods      :      Calls  SetupTime  SolveTime SolveNodes       Sols       Best       Exp3  EpsGreedy        UCB TgtFixRate  Opt  Inf Node Stal  Sol  Usr Othr Actv
  rens             :          0       0.00       0.00          0          0          0    0.00000   -1.00000    1.00000      0.900    0    0    0    0    0    0    0    1
  rins             :          0       0.00       0.00          0          0          0    0.00000   -1.00000    1.00000      0.900    0    0    0    0    0    0    0    1
  mutation         :          0       0.00       0.00          0          0          0    0.00000   -1.00000    1.00000      0.900    0    0    0    0    0    0    0    1
  localbranching   :          0       0.00       0.00          0          0          0    0.00000   -1.00000    1.00000      0.900    0    0    0    0    0    0    0    1
  crossover        :          0       0.00       0.00          0          0          0    0.00000   -1.00000    1.00000      0.900    0    0    0    0    0    0    0    1
  proximity        :          0       0.00       0.00          0          0          0    0.00000   -1.00000    1.00000      0.900    0    0    0    0    0    0    0    1
  zeroobjective    :          0       0.00       0.00          0          0          0    0.00000   -1.00000    1.00000      0.900    0    0    0    0    0    0    0    1
  dins             :          0       0.00       0.00          0          0          0    0.00000   -1.00000    1.00000      0.900    0    0    0    0    0    0    0    1
  trustregion      :          0       0.00       0.00          0          0          0    0.00000   -1.00000    1.00000      0.900    0    0    0    0    0    0    0    0
LP                 :       Time      Calls Iterations  Iter/call   Iter/sec  Time-0-It Calls-0-It    ItLimit
  primal LP        :       0.00          0          0       0.00          -       0.00          0
  dual LP          :       0.00          4        156      39.00          -       0.00          0
  lex dual LP      :       0.00          0          0       0.00          -
  barrier LP       :       0.00          0          0       0.00          -       0.00          0
  resolve instable :       0.00          0          0       0.00          -
  diving/probing LP:       0.01          1        111     111.00    9312.86
  strong branching :       0.00          0          0       0.00          -          -          -          0
    (at root node) :          -          0          0       0.00          -
  conflict analysis:       0.00          0          0       0.00          -
B&B Tree           :
  number of runs   :          1
  nodes            :          1 (0 internal, 1 leaves)
  feasible leaves  :          0
  infeas. leaves   :          0
  objective leaves :          0
  nodes (total)    :          1 (0 internal, 1 leaves)
  nodes left       :          0
  max depth        :          0
  max depth (total):          0
  backtracks       :          0 (0.0%)
  early backtracks :          0 (0.0%)
  nodes exc. ref.  :          0 (0.0%)
  delayed cutoffs  :          0
  repropagations   :          0 (0 domain reductions, 0 cutoffs)
  avg switch length:       2.00
  switching time   :       0.00
Estim. Tree Size   :          1
Estimation Tree    : 1 nodes (1 visited, 0 internal, 1 leaves, 0 open), weight: 1.0000 completed 1.0000
Estimations        :      estim      value      trend resolution     smooth
  wbe              :          1          -          -          -          -
  tree-profile     :         -1          -          -          -          -
  gap              :          1    1.00000    1.00000          1          1
  tree-weight      :          1    1.00000    1.00000          1          1
  leaf-frequency   :          1    0.50000    1.00000          1          1
  ssg              :          1    0.00000   -1.00000          1          1
  open-nodes       :          1    0.00000    0.00000          1          1
Root Node          :
  First LP value   : +2.24958176061656e+05
  First LP Iters   :        151 (192848.02 Iter/sec)
  First LP Time    :       0.00
  Final Dual Bound : +2.21350901052457e+05
  Final Root Iters :        156
  Root LP Estimate :                     -
Solution           :
  Solutions found  :          3 (2 improvements)
  First Solution   : +1.66445735548031e+05   (in run 1, after 1 nodes, 0.33 seconds, depth 22, found by <locks>)
  Gap First Sol.   :    2559.74 %
  Gap Last Sol.    :       0.19 %
  Primal Bound     : +2.21350901052457e+05   (in run 1, after 1 nodes, 0.36 seconds, depth 2, found by <randrounding>)
  Dual Bound       : +2.21350901052457e+05
  Gap              :       0.00 %
Integrals          :      Total       Avg%
  primal-dual      :      34.54      94.09
  primal-ref       :          -          - (not evaluated)
  dual-ref         :          -          - (not evaluated)
