SCIP version 7.0.2 [precision: 8 byte] [memory: block] [mode: optimized] [LP solver: SoPlex 5.0.2] [GitHash: dafb536cfd]
Copyright (C) 2002-2020 Konrad-Zuse-Zentrum fuer Informationstechnik Berlin (ZIB)

External codes: 
  Readline 7.0         GNU library for command line editing (gnu.org/s/readline)
  SoPlex 5.0.2         Linear Programming Solver developed at Zuse Institute Berlin (soplex.zib.de) [GitHash: 3623dbc0]
  CppAD 20180000.0     Algorithmic Differentiation of C++ algorithms developed by B. Bell (www.coin-or.org/CppAD)
  ZLIB 1.2.11          General purpose compression library by J. Gailly and M. Adler (zlib.net)
  GMP 6.1.2            GNU Multiple Precision Arithmetic Library developed by T. Granlund (gmplib.org)
  ZIMPL 3.4.0          Zuse Institute Mathematical Programming Language developed by T. Koch (zimpl.zib.de)
  PaPILO 1.0.1         parallel presolve for integer and linear optimization (https://github.com/lgottwald/PaPILO) [GitHash: 0638fc4]
  bliss 0.73p          Computing Graph Automorphism Groups by T. Junttila and P. Kaski (http://www.tcs.hut.fi/Software/bliss/)
  Ipopt 3.13.2         Interior Point Optimizer developed by A. Waechter et.al. (www.coin-or.org/Ipopt)

user parameter file <scip.set> not found - using default parameters

read problem <model_strategy_2eng.zpl>
============


base directory for ZIMPL parsing: </workspace>

original problem has 21497 variables (72 bin, 0 int, 0 impl, 21425 cont) and 31209 constraints

solve problem
=============

presolving:
(round 1, fast)       12399 del vars, 14032 del conss, 0 add conss, 16541 chg bounds, 0 chg sides, 0 chg coeffs, 0 upgd conss, 0 impls, 0 clqs
(round 2, fast)       21359 del vars, 30907 del conss, 0 add conss, 25590 chg bounds, 2 chg sides, 10 chg coeffs, 0 upgd conss, 0 impls, 0 clqs
(round 3, fast)       21367 del vars, 31040 del conss, 0 add conss, 25594 chg bounds, 3 chg sides, 11 chg coeffs, 0 upgd conss, 0 impls, 0 clqs
(round 4, fast)       21367 del vars, 31040 del conss, 0 add conss, 25601 chg bounds, 9 chg sides, 11 chg coeffs, 0 upgd conss, 0 impls, 0 clqs
(round 5, fast)       21367 del vars, 31040 del conss, 0 add conss, 25607 chg bounds, 9 chg sides, 14 chg coeffs, 0 upgd conss, 0 impls, 0 clqs
(round 6, fast)       21367 del vars, 31040 del conss, 0 add conss, 25613 chg bounds, 9 chg sides, 14 chg coeffs, 0 upgd conss, 0 impls, 0 clqs
(round 7, fast)       21367 del vars, 31040 del conss, 0 add conss, 25617 chg bounds, 9 chg sides, 14 chg coeffs, 0 upgd conss, 0 impls, 0 clqs
(round 8, fast)       21367 del vars, 31040 del conss, 0 add conss, 25619 chg bounds, 9 chg sides, 14 chg coeffs, 0 upgd conss, 0 impls, 0 clqs
(round 9, fast)       21367 del vars, 31040 del conss, 0 add conss, 25627 chg bounds, 9 chg sides, 14 chg coeffs, 1 upgd conss, 0 impls, 0 clqs
(round 10, fast)       21371 del vars, 31043 del conss, 0 add conss, 25645 chg bounds, 9 chg sides, 14 chg coeffs, 3 upgd conss, 0 impls, 0 clqs
(round 11, fast)       21376 del vars, 31046 del conss, 0 add conss, 25656 chg bounds, 9 chg sides, 17 chg coeffs, 3 upgd conss, 0 impls, 0 clqs
(round 12, fast)       21376 del vars, 31046 del conss, 0 add conss, 25662 chg bounds, 11 chg sides, 17 chg coeffs, 3 upgd conss, 0 impls, 0 clqs
(round 13, fast)       21376 del vars, 31046 del conss, 0 add conss, 25664 chg bounds, 11 chg sides, 17 chg coeffs, 3 upgd conss, 0 impls, 0 clqs
(round 14, fast)       21376 del vars, 31046 del conss, 0 add conss, 25668 chg bounds, 11 chg sides, 17 chg coeffs, 3 upgd conss, 0 impls, 0 clqs
(round 15, fast)       21376 del vars, 31048 del conss, 0 add conss, 25677 chg bounds, 11 chg sides, 17 chg coeffs, 3 upgd conss, 0 impls, 0 clqs
(round 16, fast)       21376 del vars, 31048 del conss, 0 add conss, 25682 chg bounds, 11 chg sides, 17 chg coeffs, 3 upgd conss, 0 impls, 0 clqs
(round 17, fast)       21376 del vars, 31048 del conss, 0 add conss, 25684 chg bounds, 11 chg sides, 17 chg coeffs, 3 upgd conss, 0 impls, 0 clqs
(round 18, fast)       21376 del vars, 31048 del conss, 0 add conss, 25685 chg bounds, 11 chg sides, 17 chg coeffs, 3 upgd conss, 0 impls, 0 clqs
(round 19, fast)       21376 del vars, 31048 del conss, 0 add conss, 25685 chg bounds, 11 chg sides, 18 chg coeffs, 3 upgd conss, 0 impls, 0 clqs
   (0.2s) running MILP presolver
   (0.2s) MILP presolver (10 rounds): 42 aggregations, 5 fixings, 5 bound changes
(round 20, medium)     21423 del vars, 31209 del conss, 73 add conss, 25690 chg bounds, 11 chg sides, 18 chg coeffs, 3 upgd conss, 0 impls, 0 clqs
(round 21, fast)       21424 del vars, 31209 del conss, 73 add conss, 25690 chg bounds, 11 chg sides, 18 chg coeffs, 3 upgd conss, 0 impls, 0 clqs
(round 22, fast)       21424 del vars, 31209 del conss, 73 add conss, 25690 chg bounds, 12 chg sides, 18 chg coeffs, 3 upgd conss, 0 impls, 0 clqs
(round 23, exhaustive) 21424 del vars, 31241 del conss, 73 add conss, 25690 chg bounds, 42 chg sides, 18 chg coeffs, 3 upgd conss, 0 impls, 0 clqs
(round 24, fast)       21427 del vars, 31241 del conss, 73 add conss, 25690 chg bounds, 42 chg sides, 18 chg coeffs, 3 upgd conss, 0 impls, 0 clqs
(round 25, fast)       21427 del vars, 31241 del conss, 73 add conss, 25690 chg bounds, 45 chg sides, 18 chg coeffs, 3 upgd conss, 0 impls, 0 clqs
(round 26, fast)       21430 del vars, 31242 del conss, 73 add conss, 25690 chg bounds, 45 chg sides, 18 chg coeffs, 3 upgd conss, 0 impls, 0 clqs
   (0.2s) running MILP presolver
   (0.2s) MILP presolver (3 rounds): 0 aggregations, 6 fixings, 0 bound changes
(round 27, medium)     21436 del vars, 31242 del conss, 73 add conss, 25690 chg bounds, 45 chg sides, 18 chg coeffs, 3 upgd conss, 0 impls, 0 clqs
(round 28, exhaustive) 21436 del vars, 31242 del conss, 73 add conss, 25690 chg bounds, 45 chg sides, 18 chg coeffs, 4 upgd conss, 0 impls, 0 clqs
(round 29, exhaustive) 21436 del vars, 31242 del conss, 73 add conss, 25690 chg bounds, 45 chg sides, 18 chg coeffs, 5 upgd conss, 1 impls, 0 clqs
   (0.2s) probing cycle finished: starting next cycle
   (0.2s) symmetry computation started: requiring (bin +, int -, cont +), (fixed: bin -, int +, cont -)
   (0.2s) no symmetry present
presolving (30 rounds: 30 fast, 6 medium, 4 exhaustive):
 21436 deleted vars, 31242 deleted constraints, 73 added constraints, 25690 tightened bounds, 0 added holes, 45 changed sides, 18 changed coefficients
 48 implications, 0 cliques
presolved problem has 61 variables (13 bin, 0 int, 0 impl, 48 cont) and 40 constraints
      2 constraints of type <varbound>
     38 constraints of type <linear>
Presolving Time: 0.17

 time | node  | left  |LP iter|LP it/n|mem/heur|mdpt |vars |cons |rows |cuts |sepa|confs|strbr|  dualbound   | primalbound  |  gap   | compl. 
p 0.2s|     1 |     0 |    29 |     - |   locks|   0 |  61 |  40 |  40 |   0 |  0 |   0 |   0 | 1.462750e+06 | 1.468978e+05 | 895.76%| unknown
  0.3s|     1 |     0 |    60 |     - |    84M |   0 |  61 |  40 |  40 |   0 |  0 |   0 |   0 | 1.867526e+05 | 1.468978e+05 |  27.13%| unknown
r 0.3s|     1 |     0 |    60 |     - |randroun|   0 |  61 |  40 |  40 |   0 |  0 |   0 |   0 | 1.867526e+05 | 1.826542e+05 |   2.24%| unknown
  0.3s|     1 |     0 |    61 |     - |    85M |   0 |  61 |  40 |  41 |   1 |  1 |   0 |   0 | 1.867179e+05 | 1.826542e+05 |   2.22%| unknown
r 0.3s|     1 |     0 |    61 |     - |randroun|   0 |  61 |  40 |  40 |   0 |  1 |   0 |   0 | 1.867179e+05 | 1.861868e+05 |   0.29%| unknown
  0.3s|     1 |     0 |    61 |     - |    85M |   0 |  61 |  40 |  40 |   1 |  1 |   0 |   0 | 1.867179e+05 | 1.861868e+05 |   0.29%| unknown
  0.3s|     1 |     0 |    61 |     - |    85M |   0 |  61 |  40 |  33 |   1 |  1 |   0 |   0 | 1.867179e+05 | 1.861868e+05 |   0.29%| unknown
  0.3s|     1 |     0 |    61 |     - |    85M |   0 |  61 |  40 |  32 |   1 |  2 |   0 |   0 | 1.867179e+05 | 1.861868e+05 |   0.29%| unknown
  0.3s|     1 |     0 |    61 |     - |    85M |   0 |  61 |  23 |  32 |   1 |  4 |   0 |   0 | 1.867179e+05 | 1.861868e+05 |   0.29%| unknown
  0.3s|     1 |     0 |    62 |     - |    85M |   0 |  61 |  23 |  33 |   2 |  5 |   0 |   0 | 1.863541e+05 | 1.861868e+05 |   0.09%| unknown
  0.3s|     1 |     0 |    63 |     - |    85M |   0 |  61 |  23 |  35 |   4 |  6 |   0 |   0 | 1.861868e+05 | 1.861868e+05 |   0.00%| unknown
* 0.3s|     1 |     0 |    63 |     - |    LP  |   0 |  61 |  23 |  35 |   4 |  8 |   0 |   0 | 1.861868e+05 | 1.861868e+05 |   0.00%| unknown

SCIP Status        : problem is solved [optimal solution found]
Solving Time (sec) : 0.30
Solving Nodes      : 1
Primal Bound       : +1.86186760221595e+05 (6 solutions)
Dual Bound         : +1.86186760221595e+05
Gap                : 0.00 %

primal solution (original space):
=================================

objective value:                     186186.760221217
s#1                                                 1 	(obj:-3660)
s#13                                0.999999999983776 	(obj:-3660)
s#23                                                1 	(obj:-3660)
k#7                                                 1 	(obj:0)
l#7                                                 1 	(obj:0)
x#1#61#3                                          587 	(obj:-4.62235649546828)
x#2#20#2                                           51 	(obj:-22.2606332267352)
x#2#62#3                                          587 	(obj:-4.59924471299094)
x#3#21#2                                           51 	(obj:-23.1501314123104)
x#3#63#3                                          587 	(obj:-4.57624848942598)
x#4#22#2                                           51 	(obj:-17.2599475714296)
x#4#64#3                                          587 	(obj:-4.55336724697885)
x#5#23#2                                           51 	(obj:-17.1736478335724)
x#5#65#3                                          587 	(obj:-4.53060041074396)
x#6#24#2                                           51 	(obj:-17.0877795944046)
x#6#66#3                                          587 	(obj:-4.50794740869024)
x#7#0#1                                        205.45 	(obj:-44.6180040036807)
x#7#0#2                                        205.45 	(obj:-44.6180040036807)
x#7#25#2                                           51 	(obj:-17.0023406964325)
x#7#67#3                                          587 	(obj:-4.48540767164679)
x#8#1#1                                        205.45 	(obj:-5.06178814084896)
x#8#1#2                                        205.45 	(obj:-5.06178814084896)
x#8#26#2                                           51 	(obj:-16.9173289929504)
x#8#68#3                                       504.82 	(obj:-4.46298063328855)
x#9#2#1                                        205.45 	(obj:-5.8162383198534)
x#9#2#2                                        205.45 	(obj:-5.8162383198534)
x#9#27#2                                           51 	(obj:-16.8327423479856)
x#9#69#3                                       504.82 	(obj:-4.44066573012211)
x#10#3#1                                       205.45 	(obj:-6.57222787520623)
x#10#3#2                                       205.45 	(obj:-6.57222787520623)
x#10#28#2                                          51 	(obj:-16.7485786362457)
x#10#70#3                                      504.82 	(obj:-4.4184624014715)
x#11#4#1                                       205.45 	(obj:-7.33064774016375)
x#11#4#2                                       205.45 	(obj:-7.33064774016375)
x#11#29#2                                          51 	(obj:-16.6648357430645)
x#11#71#3                                      504.82 	(obj:-4.39637008946414)
x#12#5#1                                       205.45 	(obj:-8.09237041802197)
x#12#5#2                                       205.45 	(obj:-8.09237041802197)
x#12#30#2                                          51 	(obj:-16.5815115643491)
x#12#72#3                                      504.82 	(obj:-4.37438823901682)
x#13#6#1                                       205.45 	(obj:-8.85825021583464)
x#13#6#2                                       205.45 	(obj:-8.85825021583464)
x#13#31#2                                          51 	(obj:-16.4986040065274)
x#13#73#3                                      504.82 	(obj:-4.35251629782174)
x#14#7#2                                      143.815 	(obj:-9.62662776522665)
x#14#74#3                                      504.82 	(obj:-4.33075371633263)
x#15#8#2                                      143.815 	(obj:-10.3952017952447)
x#15#75#3                                      504.82 	(obj:-4.30909994775097)
x#16#9#2                                      143.815 	(obj:-11.1638517582648)
x#16#76#3                                      504.82 	(obj:-4.28755444801221)
x#17#10#2                                     143.815 	(obj:-11.9324590984181)
x#17#77#3                                      504.82 	(obj:-4.26611667577215)
x#18#11#2                                     143.815 	(obj:-12.7009072292596)
x#18#78#3                                      504.82 	(obj:-4.24478609239329)
x#19#0#1                                      176.687 	(obj:-42.0133301688626)
x#19#0#2                                      176.687 	(obj:-42.0133301688626)
x#19#12#2                                      61.635 	(obj:-13.4690815116444)
x#19#12#3                                       82.18 	(obj:0)
x#19#79#3                                      504.82 	(obj:-4.22356216193132)
x#20#1#1                                      176.687 	(obj:-4.76629515719209)
x#20#1#2                                      176.687 	(obj:-4.76629515719209)
x#20#13#2                                      61.635 	(obj:-14.2368692318111)
x#20#13#3                                       82.18 	(obj:-4.20244435112166)
x#20#80#3                                      504.82 	(obj:-4.20244435112166)
x#21#2#1                                      176.687 	(obj:-5.47670265242332)
x#21#2#2                                      176.687 	(obj:-5.47670265242332)
x#21#14#2                                      61.635 	(obj:-15.0041595796689)
x#21#14#3                                       82.18 	(obj:-4.18143212936606)
x#21#81#3                                      504.82 	(obj:-4.18143212936606)
x#22#3#1                                      176.687 	(obj:-6.1885596595326)
x#22#3#2                                      176.687 	(obj:-6.1885596595326)
x#22#15#2                                      61.635 	(obj:-15.7708436272878)
x#22#15#3                                       82.18 	(obj:-4.16052496871923)
x#22#82#3                                      504.82 	(obj:-4.16052496871923)
x#23#4#1                                      176.687 	(obj:-6.90270510159352)
x#23#4#2                                      176.687 	(obj:-6.90270510159352)
x#23#16#2                                      61.635 	(obj:-16.5368143075903)
x#23#16#3                                       82.18 	(obj:-4.13972234387563)
x#23#83#3                                      504.82 	(obj:-4.13972234387563)
x#24#5#1                                      176.687 	(obj:-7.61996054760871)
x#24#5#2                                      176.687 	(obj:-7.61996054760871)
x#24#17#3                                       82.18 	(obj:-4.11902373215625)
x#24#84#3                                      504.82 	(obj:-4.11902373215625)
x#0#6#1                                           136 	(obj:0)
x#0#6#2                                           127 	(obj:0)
x#0#7#1                                           156 	(obj:0)
x#0#7#2                                           132 	(obj:0)
x#0#17#2                                           54 	(obj:0)
x#0#18#2                                           51 	(obj:0)
x#0#60#3                                          587 	(obj:0)
y#1#7#1                                           136 	(obj:347)
y#1#7#2                                           127 	(obj:347)
y#1#8#1                                           156 	(obj:347)
y#1#8#2                                           132 	(obj:347)
y#1#18#2                                           54 	(obj:646)
y#7#67#3                             82.1799999999999 	(obj:157)
y#13#6#1                                       205.45 	(obj:233)
y#13#6#2                                       61.635 	(obj:233)
y#13#31#2                            50.9999999991726 	(obj:508)
y#23#16#2                                      61.635 	(obj:328)
w#18#11                                         82.18 	(obj:0)
n#7#1                                          205.45 	(obj:0)
n#7#2                                          205.45 	(obj:0)
n#19#1                                        176.687 	(obj:0)
n#19#2                                        176.687 	(obj:0)
x#1#7#1                                           136 	(obj:-10.2748178018611)
x#1#7#2                                           127 	(obj:-10.2748178018611)
x#1#8#1                                           156 	(obj:-11.150896735415)
x#1#8#2                                           132 	(obj:-11.150896735415)
x#1#18#2                                           54 	(obj:-20.3834863654341)
x#1#19#2                                           51 	(obj:-21.3707218504201)

Statistics
==========

SCIP Status        : problem is solved [optimal solution found]
Total Time         :       0.76
  solving          :       0.30
  presolving       :       0.17 (included in solving)
  reading          :       0.46
  copying          :       0.01 (1 #copies) (minimal 0.01, maximal 0.01, average 0.01)
Original Problem   :
  Problem name     : model_strategy_2eng.zpl
  Variables        : 21497 (72 binary, 0 integer, 0 implicit integer, 21425 continuous)
  Constraints      : 31209 initial, 31209 maximal
  Objective        : maximize, 10406 non-zeros (abs.min = 4.11902, abs.max = 3660)
Presolved Problem  :
  Problem name     : t_model_strategy_2eng.zpl
  Variables        : 61 (13 binary, 0 integer, 0 implicit integer, 48 continuous)
  Constraints      : 40 initial, 40 maximal
  Objective        : minimize, 61 non-zeros (abs.min = 0.954248, abs.max = 3660)
  Nonzeros         : 162 constraint, 0 clique table
Presolvers         :   ExecTime  SetupTime  Calls  FixedVars   AggrVars   ChgTypes  ChgBounds   AddHoles    DelCons    AddCons   ChgSides   ChgCoefs
  boundshift       :       0.00       0.00      0          0          0          0          0          0          0          0          0          0
  convertinttobin  :       0.00       0.00      0          0          0          0          0          0          0          0          0          0
  domcol           :       0.00       0.00      1          0          0          0          0          0          0          0          0          0
  dualagg          :       0.00       0.00      0          0          0          0          0          0          0          0          0          0
  dualcomp         :       0.00       0.00      1          0          0          0          0          0          0          0          0          0
  dualinfer        :       0.00       0.00      0          0          0          0          0          0          0          0          0          0
  dualsparsify     :       0.00       0.00      1          0          0          0          0          0          0          0          0          0
  gateextraction   :       0.00       0.00      0          0          0          0          0          0          0          0          0          0
  implics          :       0.00       0.00      6          0          0          0          0          0          0          0          0          0
  inttobinary      :       0.00       0.00      0          0          0          0          0          0          0          0          0          0
  milp             :       0.03       0.00      2         11         42          0          5          0        161         73          0          0
  qpkktref         :       0.00       0.00      0          0          0          0          0          0          0          0          0          0
  redvub           :       0.00       0.00      0          0          0          0          0          0          0          0          0          0
  sparsify         :       0.00       0.00      1          0          0          0          0          0          0          0          0          0
  stuffing         :       0.00       0.00      0          0          0          0          0          0          0          0          0          0
  trivial          :       0.00       0.00     30          2          0          0          0          0          0          0          0          0
  tworowbnd        :       0.00       0.00      0          0          0          0          0          0          0          0          0          0
  dualfix          :       0.00       0.00     30         55          0          0          0          0          0          0          0          0
  genvbounds       :       0.00       0.00      0          0          0          0          0          0          0          0          0          0
  probing          :       0.01       0.00      1          0          0          0          0          0          0          0          0          0
  pseudoobj        :       0.00       0.00      0          0          0          0          0          0          0          0          0          0
  symmetry         :       0.00       0.00      1          0          0          0          0          0          0          0          0          0
  vbounds          :       0.00       0.00      0          0          0          0          0          0          0          0          0          0
  varbound         :       0.00       0.00      4          0          0          0          0          0          0          0          0          0
  linear           :       0.08       0.01     34      19454       1872          0      25674          0      31081          0         45         18
  quadratic        :       0.00       0.00     10          0          0          0         11          0          0          0          0          0
  benders          :       0.00       0.00      0          0          0          0          0          0          0          0          0          0
  components       :       0.00       0.00      1          0          0          0          0          0          0          0          0          0
  root node        :          -          -      -          8          -          -         28          -          -          -          -          -
Constraints        :     Number  MaxNumber  #Separate #Propagate    #EnfoLP    #EnfoRelax  #EnfoPS    #Check   #ResProp    Cutoffs    DomReds       Cuts    Applied      Conss   Children
  benderslp        :          0          0          0          0          0          0          0         15          0          0          0          0          0          0          0
  integral         :          0          0          0          0          0          0          0         15          0          0          0          0          0          0          0
  varbound         :          2          2          3         59          0          0          0          7          0          0          1          0          0          0          0
  linear           :         38         38          6         66          0          0          0          8          0          1         18          0          0          0          0
  benders          :          0          0          0          0          0          0          0          7          0          0          0          0          0          0          0
  countsols        :          0          0          0          0          0          0          0          7          0          0          0          0          0          0          0
  components       :          0          0          0          0          0          0          0          0          0          0          0          0          0          0          0
Constraint Timings :  TotalTime  SetupTime   Separate  Propagate     EnfoLP     EnfoPS     EnfoRelax   Check    ResProp    SB-Prop
  benderslp        :       0.00       0.00       0.00       0.00       0.00       0.00       0.00       0.00       0.00       0.00
  integral         :       0.00       0.00       0.00       0.00       0.00       0.00       0.00       0.00       0.00       0.00
  varbound         :       0.00       0.00       0.00       0.00       0.00       0.00       0.00       0.00       0.00       0.00
  linear           :       0.01       0.01       0.00       0.00       0.00       0.00       0.00       0.00       0.00       0.00
  benders          :       0.00       0.00       0.00       0.00       0.00       0.00       0.00       0.00       0.00       0.00
  countsols        :       0.00       0.00       0.00       0.00       0.00       0.00       0.00       0.00       0.00       0.00
  components       :       0.00       0.00       0.00       0.00       0.00       0.00       0.00       0.00       0.00       0.00
Propagators        : #Propagate   #ResProp    Cutoffs    DomReds
  dualfix          :          5          0          0          1
  genvbounds       :          0          0          0          0
  nlobbt           :          0          0          0          0
  obbt             :          0          0          0          0
  probing          :          0          0          0          0
  pseudoobj        :         17          0          0          0
  redcost          :         10          0          0          8
  rootredcost      :          0          0          0          0
  symmetry         :          0          0          0          0
  vbounds          :         28          0          0          0
Propagator Timings :  TotalTime  SetupTime   Presolve  Propagate    ResProp    SB-Prop
  dualfix          :       0.00       0.00       0.00       0.00       0.00       0.00
  genvbounds       :       0.00       0.00       0.00       0.00       0.00       0.00
  nlobbt           :       0.00       0.00       0.00       0.00       0.00       0.00
  obbt             :       0.00       0.00       0.00       0.00       0.00       0.00
  probing          :       0.01       0.00       0.01       0.00       0.00       0.00
  pseudoobj        :       0.00       0.00       0.00       0.00       0.00       0.00
  redcost          :       0.00       0.00       0.00       0.00       0.00       0.00
  rootredcost      :       0.00       0.00       0.00       0.00       0.00       0.00
  symmetry         :       0.00       0.00       0.00       0.00       0.00       0.00
  vbounds          :       0.00       0.00       0.00       0.00       0.00       0.00
Conflict Analysis  :       Time      Calls    Success    DomReds  Conflicts   Literals    Reconvs ReconvLits   Dualrays   Nonzeros   LP Iters   (pool size: [--,--])
  propagation      :       0.00          0          0          -          0        0.0          0        0.0          -          -          -
  infeasible LP    :       0.00          0          0          -          0        0.0          0        0.0          0        0.0          0
  bound exceed. LP :       0.00          0          0          -          0        0.0          0        0.0          0        0.0          0
  strong branching :       0.00          0          0          -          0        0.0          0        0.0          -          -          0
  pseudo solution  :       0.00          0          0          -          0        0.0          0        0.0          -          -          -
  applied globally :       0.00          -          -          0          0        0.0          -          -          0          -          -
  applied locally  :          -          -          -          0          0        0.0          -          -          0          -          -
Separators         :   ExecTime  SetupTime      Calls    Cutoffs    DomReds       Cuts    Applied      Conss
  cut pool         :       0.00                     9          -          -         19          -          -    (maximal pool size: 12)
  aggregation      :       0.01       0.00          5          0          0          4          0          0
  cgmip            :       0.00       0.00          0          0          0          0          0          0
  clique           :       0.00       0.00          1          0          0          0          0          0
  closecuts        :       0.00       0.00          0          0          0          0          0          0
  cmir             :       0.00       0.00          0          0          0          0          0          0
  convexproj       :       0.00       0.00          0          0          0          0          0          0
  disjunctive      :       0.00       0.00          0          0          0          0          0          0
  eccuts           :       0.00       0.00          0          0          0          0          0          0
  flowcover        :       0.00       0.00          0          0          0          0          0          0
  gauge            :       0.00       0.00          0          0          0          0          0          0
  gomory           :       0.00       0.00          5          0          0          3          0          0
  impliedbounds    :       0.00       0.00          5          0          0          5          4          0
  intobj           :       0.00       0.00          0          0          0          0          0          0
  mcf              :       0.00       0.00          1          0          0          0          0          0
  oddcycle         :       0.00       0.00          0          0          0          0          0          0
  rapidlearning    :       0.00       0.00          0          0          0          0          0          0
  strongcg         :       0.00       0.00          5          0          0          0          0          0
  zerohalf         :       0.00       0.00          5          0          0          0          0          0
Pricers            :   ExecTime  SetupTime      Calls       Vars
  problem variables:       0.00          -          0          0
Branching Rules    :   ExecTime  SetupTime   BranchLP  BranchExt   BranchPS    Cutoffs    DomReds       Cuts      Conss   Children
  allfullstrong    :       0.00       0.00          0          0          0          0          0          0          0          0
  cloud            :       0.00       0.00          0          0          0          0          0          0          0          0
  distribution     :       0.00       0.00          0          0          0          0          0          0          0          0
  fullstrong       :       0.00       0.00          0          0          0          0          0          0          0          0
  inference        :       0.00       0.00          0          0          0          0          0          0          0          0
  leastinf         :       0.00       0.00          0          0          0          0          0          0          0          0
  lookahead        :       0.00       0.00          0          0          0          0          0          0          0          0
  mostinf          :       0.00       0.00          0          0          0          0          0          0          0          0
  multaggr         :       0.00       0.00          0          0          0          0          0          0          0          0
  nodereopt        :       0.00       0.00          0          0          0          0          0          0          0          0
  pscost           :       0.00       0.00          0          0          0          0          0          0          0          0
  random           :       0.00       0.00          0          0          0          0          0          0          0          0
  relpscost        :       0.00       0.00          0          0          0          0          0          0          0          0
  vanillafullstrong:       0.00       0.00          0          0          0          0          0          0          0          0
Primal Heuristics  :   ExecTime  SetupTime      Calls      Found       Best
  LP solutions     :       0.00          -          -          1          1
  relax solutions  :       0.00          -          -          0          0
  pseudo solutions :       0.00          -          -          0          0
  strong branching :       0.00          -          -          0          0
  actconsdiving    :       0.00       0.00          0          0          0
  adaptivediving   :       0.00       0.00          0          0          0
  alns             :       0.02       0.00          1          0          0
  bound            :       0.00       0.00          0          0          0
  clique           :       0.00       0.00          0          0          0
  coefdiving       :       0.00       0.00          0          0          0
  completesol      :       0.00       0.00          0          0          0
  conflictdiving   :       0.00       0.00          0          0          0
  crossover        :       0.00       0.00          0          0          0
  dins             :       0.00       0.00          0          0          0
  distributiondivin:       0.00       0.00          0          0          0
  dualval          :       0.00       0.00          0          0          0
  farkasdiving     :       0.00       0.00          0          0          0
  feaspump         :       0.00       0.00          0          0          0
  fixandinfer      :       0.00       0.00          0          0          0
  fracdiving       :       0.00       0.00          0          0          0
  gins             :       0.00       0.00          0          0          0
  guideddiving     :       0.00       0.00          0          0          0
  indicator        :       0.00       0.00          0          0          0
  intdiving        :       0.00       0.00          0          0          0
  intshifting      :       0.00       0.00          0          0          0
  linesearchdiving :       0.00       0.00          0          0          0
  localbranching   :       0.00       0.00          0          0          0
  locks            :       0.02       0.00          1          1          1
  lpface           :       0.00       0.00          0          0          0
  mpec             :       0.00       0.00          0          0          0
  multistart       :       0.00       0.00          0          0          0
  mutation         :       0.00       0.00          0          0          0
  nlpdiving        :       0.00       0.00          0          0          0
  objpscostdiving  :       0.00       0.00          0          0          0
  octane           :       0.00       0.00          0          0          0
  ofins            :       0.00       0.00          0          0          0
  oneopt           :       0.00       0.00          3          0          0
  padm             :       0.00       0.00          0          0          0
  proximity        :       0.00       0.00          0          0          0
  pscostdiving     :       0.00       0.00          0          0          0
  randrounding     :       0.00       0.00          3          2          2
  rens             :       0.00       0.00          0          0          0
  reoptsols        :       0.00       0.00          0          0          0
  repair           :       0.00       0.00          0          0          0
  rins             :       0.00       0.00          0          0          0
  rootsoldiving    :       0.00       0.00          0          0          0
  rounding         :       0.00       0.00          3          0          0
  shiftandpropagate:       0.00       0.00          0          0          0
  shifting         :       0.00       0.00          3          2          0
  simplerounding   :       0.00       0.00          0          0          0
  subnlp           :       0.00       0.00          0          0          0
  trivial          :       0.02       0.00          2          0          0
  trivialnegation  :       0.00       0.00          0          0          0
  trustregion      :       0.00       0.00          0          0          0
  trysol           :       0.00       0.00          0          0          0
  twoopt           :       0.00       0.00          0          0          0
  undercover       :       0.00       0.00          0          0          0
  vbounds          :       0.00       0.00          0          0          0
  veclendiving     :       0.00       0.00          0          0          0
  zeroobj          :       0.00       0.00          0          0          0
  zirounding       :       0.00       0.00          0          0          0
  other solutions  :          -          -          -          0          -
Diving (single)    :      Calls      Nodes   LP Iters Backtracks  Conflicts   MinDepth   MaxDepth   AvgDepth  RoundSols  NLeafSols  MinSolDpt  MaxSolDpt  AvgSolDpt
  actconsdiving    :          0          -          -          -          -          -          -          -          -          -          -          -          -
  coefdiving       :          0          -          -          -          -          -          -          -          -          -          -          -          -
  conflictdiving   :          0          -          -          -          -          -          -          -          -          -          -          -          -
  distributiondivin:          0          -          -          -          -          -          -          -          -          -          -          -          -
  farkasdiving     :          0          -          -          -          -          -          -          -          -          -          -          -          -
  fracdiving       :          0          -          -          -          -          -          -          -          -          -          -          -          -
  guideddiving     :          0          -          -          -          -          -          -          -          -          -          -          -          -
  linesearchdiving :          0          -          -          -          -          -          -          -          -          -          -          -          -
  pscostdiving     :          0          -          -          -          -          -          -          -          -          -          -          -          -
  veclendiving     :          0          -          -          -          -          -          -          -          -          -          -          -          -
Diving (adaptive)  :      Calls      Nodes   LP Iters Backtracks  Conflicts   MinDepth   MaxDepth   AvgDepth  RoundSols  NLeafSols  MinSolDpt  MaxSolDpt  AvgSolDpt
  actconsdiving    :          0          -          -          -          -          -          -          -          -          -          -          -          -
  coefdiving       :          0          -          -          -          -          -          -          -          -          -          -          -          -
  conflictdiving   :          0          -          -          -          -          -          -          -          -          -          -          -          -
  distributiondivin:          0          -          -          -          -          -          -          -          -          -          -          -          -
  farkasdiving     :          0          -          -          -          -          -          -          -          -          -          -          -          -
  fracdiving       :          0          -          -          -          -          -          -          -          -          -          -          -          -
  guideddiving     :          0          -          -          -          -          -          -          -          -          -          -          -          -
  linesearchdiving :          0          -          -          -          -          -          -          -          -          -          -          -          -
  pscostdiving     :          0          -          -          -          -          -          -          -          -          -          -          -          -
  veclendiving     :          0          -          -          -          -          -          -          -          -          -          -          -          -
Neighborhoods      :      Calls  SetupTime  SolveTime SolveNodes       Sols       Best       Exp3  EpsGreedy        UCB TgtFixRate  Opt  Inf Node Stal  Sol  Usr Othr Actv
  rens             :          0       0.00       0.00          0          0          0    0.00000   -1.00000    1.00000      0.900    0    0    0    0    0    0    0    1
  rins             :          0       0.00       0.00          0          0          0    0.00000   -1.00000    1.00000      0.900    0    0    0    0    0    0    0    1
  mutation         :          0       0.00       0.00          0          0          0    0.00000   -1.00000    1.00000      0.900    0    0    0    0    0    0    0    1
  localbranching   :          1       0.01       0.00          1          0          0    0.00000   -1.00000    1.00000      0.700    0    1    0    0    0    0    0    1
  crossover        :          0       0.00       0.00          0          0          0    0.00000   -1.00000    1.00000      0.900    0    0    0    0    0    0    0    1
  proximity        :          0       0.00       0.00          0          0          0    0.00000   -1.00000    1.00000      0.900    0    0    0    0    0    0    0    1
  zeroobjective    :          0       0.00       0.00          0          0          0    0.00000   -1.00000    1.00000      0.900    0    0    0    0    0    0    0    1
  dins             :          0       0.00       0.00          0          0          0    0.00000   -1.00000    1.00000      0.900    0    0    0    0    0    0    0    1
  trustregion      :          0       0.00       0.00          0          0          0    0.00000   -1.00000    1.00000      0.900    0    0    0    0    0    0    0    0
LP                 :       Time      Calls Iterations  Iter/call   Iter/sec  Time-0-It Calls-0-It    ItLimit
  primal LP        :       0.00          1          0       0.00          -       0.00          1
  dual LP          :       0.00          8         34       8.50          -       0.00          4
  lex dual LP      :       0.00          0          0       0.00          -
  barrier LP       :       0.00          0          0       0.00          -       0.00          0
  resolve instable :       0.00          0          0       0.00          -
  diving/probing LP:       0.01          1         29      29.00    2492.27
  strong branching :       0.00          0          0       0.00          -          -          -          0
    (at root node) :          -          0          0       0.00          -
  conflict analysis:       0.00          0          0       0.00          -
B&B Tree           :
  number of runs   :          1
  nodes            :          1 (0 internal, 1 leaves)
  feasible leaves  :          0
  infeas. leaves   :          0
  objective leaves :          0
  nodes (total)    :          1 (0 internal, 1 leaves)
  nodes left       :          0
  max depth        :          0
  max depth (total):          0
  backtracks       :          0 (0.0%)
  early backtracks :          0 (0.0%)
  nodes exc. ref.  :          0 (0.0%)
  delayed cutoffs  :          0
  repropagations   :          0 (0 domain reductions, 0 cutoffs)
  avg switch length:       2.00
  switching time   :       0.00
Estim. Tree Size   :          1
Estimation Tree    : 1 nodes (1 visited, 0 internal, 1 leaves, 0 open), weight: 1.0000 completed 1.0000
Estimations        :      estim      value      trend resolution     smooth
  wbe              :          1          -          -          -          -
  tree-profile     :         -1          -          -          -          -
  gap              :          1    1.00000    1.00000          1          1
  tree-weight      :          1    1.00000    1.00000          1          1
  leaf-frequency   :          1    0.50000    1.00000          1          1
  ssg              :          1    0.00000   -1.00000          1          1
  open-nodes       :          1    0.00000    0.00000          1          1
Root Node          :
  First LP value   : +1.86752558947557e+05
  First LP Iters   :         31 (103678.93 Iter/sec)
  First LP Time    :       0.00
  Final Dual Bound : +1.86186760221595e+05
  Final Root Iters :         34
  Root LP Estimate : +1.86186760221595e+05
Solution           :
  Solutions found  :          6 (4 improvements)
  First Solution   : +1.46897754326281e+05   (in run 1, after 1 nodes, 0.25 seconds, depth 14, found by <locks>)
  Gap First Sol.   :     895.76 %
  Gap Last Sol.    :       0.00 %
  Primal Bound     : +1.86186760221595e+05   (in run 1, after 1 nodes, 0.30 seconds, depth 0, found by <relaxation>)
  Dual Bound       : +1.86186760221595e+05
  Gap              :       0.00 %
Integrals          :      Total       Avg%
  primal-dual      :      25.11      83.25
  primal-ref       :          -          - (not evaluated)
  dual-ref         :          -          - (not evaluated)
