SCIP version 7.0.2 [precision: 8 byte] [memory: block] [mode: optimized] [LP solver: SoPlex 5.0.2] [GitHash: dafb536cfd]
Copyright (C) 2002-2020 Konrad-Zuse-Zentrum fuer Informationstechnik Berlin (ZIB)

External codes: 
  Readline 7.0         GNU library for command line editing (gnu.org/s/readline)
  SoPlex 5.0.2         Linear Programming Solver developed at Zuse Institute Berlin (soplex.zib.de) [GitHash: 3623dbc0]
  CppAD 20180000.0     Algorithmic Differentiation of C++ algorithms developed by B. Bell (www.coin-or.org/CppAD)
  ZLIB 1.2.11          General purpose compression library by J. Gailly and M. Adler (zlib.net)
  GMP 6.1.2            GNU Multiple Precision Arithmetic Library developed by T. Granlund (gmplib.org)
  ZIMPL 3.4.0          Zuse Institute Mathematical Programming Language developed by T. Koch (zimpl.zib.de)
  PaPILO 1.0.1         parallel presolve for integer and linear optimization (https://github.com/lgottwald/PaPILO) [GitHash: 0638fc4]
  bliss 0.73p          Computing Graph Automorphism Groups by T. Junttila and P. Kaski (http://www.tcs.hut.fi/Software/bliss/)
  Ipopt 3.13.2         Interior Point Optimizer developed by A. Waechter et.al. (www.coin-or.org/Ipopt)

user parameter file <scip.set> not found - using default parameters

read problem <model_strategy_2eng.zpl>
============


base directory for ZIMPL parsing: </workspace>

original problem has 21497 variables (72 bin, 0 int, 0 impl, 21425 cont) and 30239 constraints

solve problem
=============

presolving:
(round 1, fast)       11526 del vars, 13062 del conss, 0 add conss, 15668 chg bounds, 0 chg sides, 0 chg coeffs, 0 upgd conss, 0 impls, 0 clqs
(round 2, fast)       21315 del vars, 29893 del conss, 0 add conss, 25682 chg bounds, 2 chg sides, 10 chg coeffs, 0 upgd conss, 0 impls, 0 clqs
(round 3, fast)       21323 del vars, 30026 del conss, 0 add conss, 25690 chg bounds, 5 chg sides, 10 chg coeffs, 0 upgd conss, 0 impls, 0 clqs
(round 4, fast)       21323 del vars, 30026 del conss, 0 add conss, 25697 chg bounds, 9 chg sides, 11 chg coeffs, 0 upgd conss, 0 impls, 0 clqs
(round 5, fast)       21323 del vars, 30026 del conss, 0 add conss, 25702 chg bounds, 9 chg sides, 13 chg coeffs, 0 upgd conss, 0 impls, 0 clqs
(round 6, fast)       21323 del vars, 30026 del conss, 0 add conss, 25706 chg bounds, 9 chg sides, 14 chg coeffs, 0 upgd conss, 0 impls, 0 clqs
(round 7, fast)       21323 del vars, 30026 del conss, 0 add conss, 25710 chg bounds, 9 chg sides, 14 chg coeffs, 0 upgd conss, 0 impls, 0 clqs
(round 8, fast)       21323 del vars, 30026 del conss, 0 add conss, 25716 chg bounds, 9 chg sides, 14 chg coeffs, 0 upgd conss, 0 impls, 0 clqs
(round 9, fast)       21323 del vars, 30026 del conss, 0 add conss, 25720 chg bounds, 9 chg sides, 14 chg coeffs, 0 upgd conss, 0 impls, 0 clqs
(round 10, fast)       21323 del vars, 30026 del conss, 0 add conss, 25724 chg bounds, 9 chg sides, 14 chg coeffs, 0 upgd conss, 0 impls, 0 clqs
(round 11, fast)       21323 del vars, 30026 del conss, 0 add conss, 25728 chg bounds, 9 chg sides, 14 chg coeffs, 0 upgd conss, 0 impls, 0 clqs
(round 12, fast)       21323 del vars, 30026 del conss, 0 add conss, 25730 chg bounds, 9 chg sides, 14 chg coeffs, 0 upgd conss, 0 impls, 0 clqs
(round 13, fast)       21323 del vars, 30026 del conss, 0 add conss, 25734 chg bounds, 9 chg sides, 14 chg coeffs, 0 upgd conss, 0 impls, 0 clqs
(round 14, fast)       21323 del vars, 30026 del conss, 0 add conss, 25742 chg bounds, 9 chg sides, 14 chg coeffs, 1 upgd conss, 0 impls, 0 clqs
(round 15, fast)       21328 del vars, 30029 del conss, 0 add conss, 25759 chg bounds, 10 chg sides, 16 chg coeffs, 3 upgd conss, 0 impls, 0 clqs
(round 16, fast)       21330 del vars, 30031 del conss, 0 add conss, 25771 chg bounds, 10 chg sides, 19 chg coeffs, 3 upgd conss, 0 impls, 0 clqs
(round 17, fast)       21330 del vars, 30031 del conss, 0 add conss, 25776 chg bounds, 10 chg sides, 19 chg coeffs, 3 upgd conss, 0 impls, 0 clqs
(round 18, fast)       21330 del vars, 30031 del conss, 0 add conss, 25782 chg bounds, 10 chg sides, 19 chg coeffs, 3 upgd conss, 0 impls, 0 clqs
(round 19, fast)       21330 del vars, 30031 del conss, 0 add conss, 25786 chg bounds, 10 chg sides, 19 chg coeffs, 3 upgd conss, 0 impls, 0 clqs
(round 20, fast)       21330 del vars, 30031 del conss, 0 add conss, 25790 chg bounds, 10 chg sides, 19 chg coeffs, 3 upgd conss, 0 impls, 0 clqs
(round 21, fast)       21330 del vars, 30031 del conss, 0 add conss, 25794 chg bounds, 10 chg sides, 19 chg coeffs, 3 upgd conss, 0 impls, 0 clqs
(round 22, fast)       21330 del vars, 30031 del conss, 0 add conss, 25796 chg bounds, 10 chg sides, 19 chg coeffs, 3 upgd conss, 0 impls, 0 clqs
(round 23, fast)       21330 del vars, 30031 del conss, 0 add conss, 25800 chg bounds, 10 chg sides, 19 chg coeffs, 3 upgd conss, 0 impls, 0 clqs
(round 24, fast)       21331 del vars, 30033 del conss, 0 add conss, 25807 chg bounds, 10 chg sides, 19 chg coeffs, 3 upgd conss, 0 impls, 0 clqs
(round 25, fast)       21332 del vars, 30034 del conss, 0 add conss, 25815 chg bounds, 11 chg sides, 19 chg coeffs, 3 upgd conss, 0 impls, 0 clqs
(round 26, fast)       21332 del vars, 30034 del conss, 0 add conss, 25822 chg bounds, 12 chg sides, 19 chg coeffs, 3 upgd conss, 0 impls, 0 clqs
(round 27, fast)       21332 del vars, 30034 del conss, 0 add conss, 25824 chg bounds, 12 chg sides, 19 chg coeffs, 3 upgd conss, 0 impls, 0 clqs
(round 28, fast)       21332 del vars, 30034 del conss, 0 add conss, 25824 chg bounds, 12 chg sides, 21 chg coeffs, 3 upgd conss, 0 impls, 0 clqs
   (0.2s) running MILP presolver
   (0.2s) MILP presolver (15 rounds): 62 aggregations, 16 fixings, 1 bound changes
(round 29, medium)     21410 del vars, 30239 del conss, 78 add conss, 25825 chg bounds, 12 chg sides, 21 chg coeffs, 3 upgd conss, 0 impls, 0 clqs
(round 30, fast)       21414 del vars, 30239 del conss, 78 add conss, 25825 chg bounds, 12 chg sides, 21 chg coeffs, 3 upgd conss, 0 impls, 0 clqs
(round 31, fast)       21414 del vars, 30239 del conss, 78 add conss, 25825 chg bounds, 16 chg sides, 21 chg coeffs, 3 upgd conss, 0 impls, 0 clqs
(round 32, fast)       21414 del vars, 30239 del conss, 78 add conss, 25826 chg bounds, 16 chg sides, 21 chg coeffs, 3 upgd conss, 0 impls, 0 clqs
(round 33, fast)       21414 del vars, 30239 del conss, 78 add conss, 25826 chg bounds, 16 chg sides, 22 chg coeffs, 3 upgd conss, 0 impls, 0 clqs
(round 34, exhaustive) 21414 del vars, 30273 del conss, 78 add conss, 25826 chg bounds, 50 chg sides, 22 chg coeffs, 3 upgd conss, 0 impls, 0 clqs
(round 35, fast)       21417 del vars, 30273 del conss, 78 add conss, 25826 chg bounds, 50 chg sides, 22 chg coeffs, 3 upgd conss, 0 impls, 0 clqs
(round 36, fast)       21417 del vars, 30273 del conss, 78 add conss, 25826 chg bounds, 53 chg sides, 22 chg coeffs, 3 upgd conss, 0 impls, 0 clqs
(round 37, fast)       21419 del vars, 30273 del conss, 78 add conss, 25826 chg bounds, 53 chg sides, 22 chg coeffs, 3 upgd conss, 0 impls, 0 clqs
   (0.2s) running MILP presolver
   (0.2s) MILP presolver (5 rounds): 6 aggregations, 13 fixings, 0 bound changes
(round 38, medium)     21438 del vars, 30273 del conss, 78 add conss, 25826 chg bounds, 53 chg sides, 22 chg coeffs, 3 upgd conss, 0 impls, 0 clqs
(round 39, fast)       21438 del vars, 30279 del conss, 78 add conss, 25826 chg bounds, 53 chg sides, 22 chg coeffs, 3 upgd conss, 0 impls, 0 clqs
(round 40, exhaustive) 21438 del vars, 30279 del conss, 78 add conss, 25826 chg bounds, 53 chg sides, 22 chg coeffs, 4 upgd conss, 0 impls, 0 clqs
(round 41, exhaustive) 21438 del vars, 30279 del conss, 78 add conss, 25826 chg bounds, 53 chg sides, 22 chg coeffs, 5 upgd conss, 1 impls, 0 clqs
   (0.2s) sparsify finished: 3/161 (1.9%) nonzeros canceled - in total 3 canceled nonzeros, 4 changed coefficients, 0 added nonzeros
(round 42, exhaustive) 21438 del vars, 30279 del conss, 78 add conss, 25826 chg bounds, 53 chg sides, 26 chg coeffs, 5 upgd conss, 2 impls, 0 clqs
(round 43, fast)       21438 del vars, 30280 del conss, 78 add conss, 25826 chg bounds, 53 chg sides, 26 chg coeffs, 5 upgd conss, 2 impls, 0 clqs
   (0.2s) probing cycle finished: starting next cycle
(round 44, exhaustive) 21438 del vars, 30280 del conss, 78 add conss, 25826 chg bounds, 53 chg sides, 29 chg coeffs, 5 upgd conss, 47 impls, 0 clqs
(round 45, fast)       21438 del vars, 30281 del conss, 78 add conss, 25827 chg bounds, 53 chg sides, 29 chg coeffs, 5 upgd conss, 47 impls, 0 clqs
(round 46, fast)       21440 del vars, 30282 del conss, 78 add conss, 25828 chg bounds, 53 chg sides, 29 chg coeffs, 5 upgd conss, 47 impls, 0 clqs
   (0.2s) probing cycle finished: starting next cycle
   (0.2s) symmetry computation started: requiring (bin +, int -, cont +), (fixed: bin -, int +, cont -)
   (0.2s) no symmetry present
presolving (47 rounds: 47 fast, 8 medium, 6 exhaustive):
 21440 deleted vars, 30282 deleted constraints, 78 added constraints, 25828 tightened bounds, 0 added holes, 53 changed sides, 29 changed coefficients
 47 implications, 0 cliques
presolved problem has 57 variables (13 bin, 0 int, 0 impl, 44 cont) and 35 constraints
      2 constraints of type <varbound>
     33 constraints of type <linear>
Presolving Time: 0.19

 time | node  | left  |LP iter|LP it/n|mem/heur|mdpt |vars |cons |rows |cuts |sepa|confs|strbr|  dualbound   | primalbound  |  gap   | compl. 
p 0.3s|     1 |     0 |    16 |     - |   locks|   0 |  57 |  35 |  35 |   0 |  0 |   0 |   0 | 1.470987e+06 | 3.252367e+05 | 352.28%| unknown
  0.3s|     1 |     0 |    29 |     - |    83M |   0 |  57 |  35 |  35 |   0 |  0 |   0 |   0 | 3.568890e+05 | 3.252367e+05 |   9.73%| unknown
  0.3s|     1 |     0 |    35 |     - |    83M |   0 |  57 |  35 |  39 |   4 |  1 |   0 |   0 | 3.498138e+05 | 3.252367e+05 |   7.56%| unknown
r 0.3s|     1 |     0 |    35 |     - |randroun|   0 |  57 |  35 |  39 |   0 |  1 |   0 |   0 | 3.498138e+05 | 3.450600e+05 |   1.38%| unknown
  0.3s|     1 |     0 |    36 |     - |    83M |   0 |  57 |  35 |  40 |   5 |  2 |   0 |   0 | 3.491056e+05 | 3.450600e+05 |   1.17%| unknown
  0.3s|     1 |     0 |    36 |     - |    85M |   0 |  57 |  35 |  39 |   5 |  2 |   0 |   0 | 3.491056e+05 | 3.450600e+05 |   1.17%| unknown
  0.3s|     1 |     0 |    36 |     - |    85M |   0 |  57 |  35 |  38 |   5 |  3 |   0 |   0 | 3.491056e+05 | 3.450600e+05 |   1.17%| unknown
L 0.3s|     1 |     0 |    36 |     - |    alns|   0 |  57 |  33 |  38 |   5 |  5 |   0 |   0 | 3.491056e+05 | 3.453429e+05 |   1.09%| unknown
  0.3s|     1 |     0 |    36 |     - |    85M |   0 |  57 |  33 |  38 |   5 |  5 |   0 |   0 | 3.491056e+05 | 3.453429e+05 |   1.09%| unknown
* 0.3s|     1 |     0 |    36 |     - |    LP  |   0 |  57 |  33 |  38 |   5 |  7 |   0 |   0 | 3.491056e+05 | 3.491056e+05 |   0.00%| unknown

SCIP Status        : problem is solved [optimal solution found]
Solving Time (sec) : 0.32
Solving Nodes      : 1
Primal Bound       : +3.49105625543924e+05 (5 solutions)
Dual Bound         : +3.49105625543924e+05
Gap                : 0.00 %

primal solution (original space):
=================================

objective value:                     349105.625543905
s#1                                                 1 	(obj:-3660)
s#9                                                 1 	(obj:-3660)
s#10                                                1 	(obj:-3660)
s#13                                                1 	(obj:-3660)
s#23                                                1 	(obj:-3660)
k#7                                                 1 	(obj:0)
l#7                                                 1 	(obj:0)
x#1#61#3                                          587 	(obj:-4.62235649546828)
x#2#8#1                                           133 	(obj:-11.150896735415)
x#2#8#2                                           128 	(obj:-11.150896735415)
x#2#9#1                                           159 	(obj:-12.0356028862058)
x#2#9#2                                           131 	(obj:-12.0356028862058)
x#2#20#2                                           58 	(obj:-22.3724957052615)
x#2#62#3                                          587 	(obj:-4.62235649546828)
x#3#9#1                                           133 	(obj:-12.0356028862058)
x#3#9#2                                           128 	(obj:-12.0356028862058)
x#3#10#1                                          159 	(obj:-12.9288727928426)
x#3#10#2                                          131 	(obj:-12.9288727928426)
x#3#21#2                                           58 	(obj:-23.3833806341359)
x#3#63#3                                          587 	(obj:-4.62235649546828)
x#4#10#1                                          133 	(obj:-12.9288727928426)
x#4#10#2                                          128 	(obj:-12.9288727928426)
x#4#11#1                                          159 	(obj:-13.8306429939341)
x#4#11#2                                          131 	(obj:-13.8306429939341)
x#4#22#2                                           58 	(obj:-17.5214575150235)
x#4#64#3                                          587 	(obj:-4.62235649546828)
x#5#11#1                                          133 	(obj:-13.8306429939341)
x#5#11#2                                          128 	(obj:-13.8306429939341)
x#5#12#1                                          159 	(obj:-14.7408500280891)
x#5#12#2                                          131 	(obj:-14.7408500280891)
x#5#23#2                                           58 	(obj:-17.5214575150235)
x#5#65#3                                          587 	(obj:-4.62235649546828)
x#6#12#1                                          133 	(obj:-14.7408500280891)
x#6#12#2                                          128 	(obj:-14.7408500280891)
x#6#13#1                                          159 	(obj:-15.6594304339164)
x#6#13#2                                          131 	(obj:-15.6594304339164)
x#6#24#2                                           58 	(obj:-17.5214575150235)
x#6#66#3                                          587 	(obj:-4.62235649546828)
x#7#0#1                                        252.41 	(obj:-45.9802844510504)
x#7#0#2                                        252.41 	(obj:-45.9802844510504)
x#7#13#1                                          133 	(obj:-15.6594304339164)
x#7#13#2                                          128 	(obj:-15.6594304339164)
x#7#14#1                                          159 	(obj:-16.5863207500249)
x#7#14#2                                          131 	(obj:-16.5863207500249)
x#7#25#2                                           58 	(obj:-17.5214575150235)
x#7#67#3                                          587 	(obj:-4.62235649546828)
x#8#1#1                                        252.41 	(obj:-5.24254779799416)
x#8#1#2                                        252.41 	(obj:-5.24254779799416)
x#8#14#1                                          133 	(obj:-16.5863207500249)
x#8#14#2                                          128 	(obj:-16.5863207500249)
x#8#15#1                                          159 	(obj:-19.2736032665258)
x#8#15#2                                          131 	(obj:-17.5214575150235)
x#8#26#2                                           58 	(obj:-17.5214575150235)
x#8#68#3                                      486.036 	(obj:-4.62235649546828)
x#9#2#1                                        252.41 	(obj:-6.05421092486207)
x#9#2#2                                        252.41 	(obj:-6.05421092486207)
x#9#15#1                                          133 	(obj:-19.2736032665258)
x#9#15#2                                          128 	(obj:-17.5214575150235)
x#9#16#1                                          159 	(obj:-20.3112549942729)
x#9#16#2                                          131 	(obj:-18.4647772675209)
x#9#27#2                                           58 	(obj:-17.5214575150235)
x#9#69#3                                      486.036 	(obj:-4.62235649546828)
x#10#3#1                                       252.41 	(obj:-6.87550949817744)
x#10#3#2                                       252.41 	(obj:-6.87550949817744)
x#10#16#1                                         133 	(obj:-20.3112549942729)
x#10#16#2                                         128 	(obj:-18.4647772675209)
x#10#28#2                                          58 	(obj:-17.5214575150235)
x#10#70#3                                     486.036 	(obj:-4.62235649546828)
x#11#4#1                                       252.41 	(obj:-7.70746468295299)
x#11#4#2                                       252.41 	(obj:-7.70746468295299)
x#11#29#2                                          58 	(obj:-17.5214575150235)
x#11#71#3                                     486.036 	(obj:-4.62235649546828)
x#12#5#1                                       252.41 	(obj:-8.55109764420144)
x#12#5#2                                       252.41 	(obj:-8.55109764420144)
x#12#30#2                                          58 	(obj:-17.5214575150235)
x#12#72#3                                     486.036 	(obj:-4.62235649546828)
x#13#6#1                                       252.41 	(obj:-9.4074295469355)
x#13#6#2                                       252.41 	(obj:-9.4074295469355)
x#13#31#2                                          58 	(obj:-17.5214575150235)
x#13#73#3                                     486.036 	(obj:-4.62235649546828)
x#14#7#1                                       252.41 	(obj:-10.2748178018611)
x#14#7#2                             176.686999998989 	(obj:-10.2748178018611)
x#14#74#3                                     486.036 	(obj:-4.62235649546828)
x#15#8#1                                       252.41 	(obj:-11.150896735415)
x#15#8#2                                      176.687 	(obj:-11.150896735415)
x#15#75#3                                     486.036 	(obj:-4.62235649546828)
x#16#9#1                                       252.41 	(obj:-12.0356028862058)
x#16#9#2                                      176.687 	(obj:-12.0356028862058)
x#16#76#3                                     486.036 	(obj:-4.62235649546828)
x#17#10#1                                      252.41 	(obj:-12.9288727928426)
x#17#10#2                                     176.687 	(obj:-12.9288727928426)
x#17#77#3                                     486.036 	(obj:-4.62235649546828)
x#18#11#1                                      252.41 	(obj:-13.8306429939341)
x#18#11#2                                     176.687 	(obj:-13.8306429939341)
x#18#78#3                                     486.036 	(obj:-4.62235649546828)
x#19#0#1                                    208.99548 	(obj:-45.9802844510504)
x#19#0#2                                    208.99548 	(obj:-45.9802844510504)
x#19#12#1                                      252.41 	(obj:-14.7408500280891)
x#19#12#2                                      75.723 	(obj:-14.7408500280891)
x#19#12#3                                     100.964 	(obj:0)
x#19#79#3                                     486.036 	(obj:-4.62235649546828)
x#20#1#1                                    208.99548 	(obj:-5.24254779799416)
x#20#1#2                                    208.99548 	(obj:-5.24254779799416)
x#20#13#1                                      252.41 	(obj:-15.6594304339164)
x#20#13#2                                      75.723 	(obj:-15.6594304339164)
x#20#13#3                                     100.964 	(obj:-4.62235649546828)
x#20#80#3                                     486.036 	(obj:-4.62235649546828)
x#21#2#1                                    208.99548 	(obj:-6.05421092486207)
x#21#2#2                                    208.99548 	(obj:-6.05421092486207)
x#21#14#1                                      252.41 	(obj:-16.5863207500249)
x#21#14#2                                      75.723 	(obj:-16.5863207500249)
x#21#14#3                                     100.964 	(obj:-4.62235649546828)
x#21#81#3                                     486.036 	(obj:-4.62235649546828)
x#22#3#1                                    208.99548 	(obj:-6.87550949817744)
x#22#3#2                                    208.99548 	(obj:-6.87550949817744)
x#22#15#1                                      252.41 	(obj:-19.2736032665258)
x#22#15#2                                      75.723 	(obj:-17.5214575150235)
x#22#15#3                                     100.964 	(obj:-4.62235649546828)
x#22#82#3                                     486.036 	(obj:-4.62235649546828)
x#23#4#1                                    208.99548 	(obj:-7.70746468295299)
x#23#4#2                                    208.99548 	(obj:-7.70746468295299)
x#23#16#1                                      252.41 	(obj:-20.3112549942729)
x#23#16#2                                      75.723 	(obj:-18.4647772675209)
x#23#16#3                                     100.964 	(obj:-4.62235649546828)
x#23#83#3                                     486.036 	(obj:-4.62235649546828)
x#24#5#1                                    208.99548 	(obj:-8.55109764420144)
x#24#5#2                                    208.99548 	(obj:-8.55109764420144)
x#24#17#3                                     100.964 	(obj:-4.62235649546828)
x#24#84#3                                     486.036 	(obj:-4.62235649546828)
x#0#6#1                                           133 	(obj:0)
x#0#6#2                                           128 	(obj:0)
x#0#7#1                                           159 	(obj:0)
x#0#7#2                                           131 	(obj:0)
x#0#17#2                                           47 	(obj:0)
x#0#18#2                                           58 	(obj:0)
x#0#60#3                                          587 	(obj:0)
y#1#18#2                                           47 	(obj:688)
y#7#67#3                                      100.964 	(obj:157)
y#9#16#1                                          159 	(obj:550)
y#9#16#2                                          131 	(obj:688)
y#10#16#1                                         133 	(obj:550)
y#10#16#2                                         128 	(obj:688)
y#13#6#2                             75.7230000010109 	(obj:369)
y#13#31#2                                          58 	(obj:793)
y#14#7#2                         -1.01087493931118e-09 	(obj:369)
y#23#16#1                                      252.41 	(obj:550)
y#23#16#2                                      75.723 	(obj:688)
w#18#11                                       100.964 	(obj:0)
n#7#1                                          252.41 	(obj:0)
n#7#2                                          252.41 	(obj:0)
n#19#1                                      208.99548 	(obj:0)
n#19#2                                      208.99548 	(obj:0)
x#1#7#1                                           133 	(obj:-10.2748178018611)
x#1#7#2                                           128 	(obj:-10.2748178018611)
x#1#8#1                                           159 	(obj:-11.150896735415)
x#1#8#2                                           131 	(obj:-11.150896735415)
x#1#18#2                                           47 	(obj:-20.3834863654341)
x#1#19#2                                           58 	(obj:-21.3707218504201)

Statistics
==========

SCIP Status        : problem is solved [optimal solution found]
Total Time         :       0.76
  solving          :       0.32
  presolving       :       0.19 (included in solving)
  reading          :       0.44
  copying          :       0.01 (1 #copies) (minimal 0.01, maximal 0.01, average 0.01)
Original Problem   :
  Problem name     : model_strategy_2eng.zpl
  Variables        : 21497 (72 binary, 0 integer, 0 implicit integer, 21425 continuous)
  Constraints      : 30239 initial, 30239 maximal
  Objective        : maximize, 11376 non-zeros (abs.min = 4.62236, abs.max = 3660)
Presolved Problem  :
  Problem name     : t_model_strategy_2eng.zpl
  Variables        : 57 (13 binary, 0 integer, 0 implicit integer, 44 continuous)
  Constraints      : 35 initial, 35 maximal
  Objective        : minimize, 57 non-zeros (abs.min = 34.2077, abs.max = 3660)
  Nonzeros         : 151 constraint, 0 clique table
Presolvers         :   ExecTime  SetupTime  Calls  FixedVars   AggrVars   ChgTypes  ChgBounds   AddHoles    DelCons    AddCons   ChgSides   ChgCoefs
  boundshift       :       0.00       0.00      0          0          0          0          0          0          0          0          0          0
  convertinttobin  :       0.00       0.00      0          0          0          0          0          0          0          0          0          0
  domcol           :       0.00       0.00      3          0          0          0          0          0          0          0          0          0
  dualagg          :       0.00       0.00      0          0          0          0          0          0          0          0          0          0
  dualcomp         :       0.00       0.00      3          0          0          0          0          0          0          0          0          0
  dualinfer        :       0.00       0.00      0          0          0          0          0          0          0          0          0          0
  dualsparsify     :       0.00       0.00      2          0          0          0          0          0          0          0          0          3
  gateextraction   :       0.00       0.00      0          0          0          0          0          0          0          0          0          0
  implics          :       0.00       0.00      8          0          0          0          0          0          0          0          0          0
  inttobinary      :       0.00       0.00      0          0          0          0          0          0          0          0          0          0
  milp             :       0.03       0.00      2         29         68          0          1          0        205         78          0          0
  qpkktref         :       0.00       0.00      0          0          0          0          0          0          0          0          0          0
  redvub           :       0.00       0.00      0          0          0          0          0          0          0          0          0          0
  sparsify         :       0.00       0.00      2          0          0          0          0          0          0          0          0          4
  stuffing         :       0.00       0.00      0          0          0          0          0          0          0          0          0          0
  trivial          :       0.00       0.00     47          2          0          0          0          0          0          0          0          0
  tworowbnd        :       0.00       0.00      0          0          0          0          0          0          0          0          0          0
  dualfix          :       0.00       0.00     47         55          0          0          0          0          0          0          0          0
  genvbounds       :       0.00       0.00      0          0          0          0          0          0          0          0          0          0
  probing          :       0.01       0.00      2          0          0          0          0          0          0          0          0          0
  pseudoobj        :       0.00       0.00      0          0          0          0          0          0          0          0          0          0
  symmetry         :       0.00       0.00      1          0          0          0          0          0          0          0          0          0
  vbounds          :       0.00       0.00      0          0          0          0          0          0          0          0          0          0
  varbound         :       0.00       0.00     11          0          0          0          0          0          0          0          0          0
  linear           :       0.09       0.01     53      19432       1854          0      25816          0      30077          0         53         22
  quadratic        :       0.00       0.00     15          0          0          0         11          0          0          0          0          0
  benders          :       0.00       0.00      0          0          0          0          0          0          0          0          0          0
  components       :       0.00       0.00      1          0          0          0          0          0          0          0          0          0
  root node        :          -          -      -          1          -          -          2          -          -          -          -          -
Constraints        :     Number  MaxNumber  #Separate #Propagate    #EnfoLP    #EnfoRelax  #EnfoPS    #Check   #ResProp    Cutoffs    DomReds       Cuts    Applied      Conss   Children
  benderslp        :          0          0          0          0          1          0          0         16          0          0          0          0          0          0          0
  integral         :          0          0          0          0          1          0          0         16          0          0          0          0          0          0          0
  varbound         :          2          2          4         88          0          0          0          8          0          0          1          0          0          0          0
  linear           :         33         33          5         90          1          0          0          9          0          0          0          0          0          0          0
  benders          :          0          0          0          0          1          0          0          6          0          0          0          0          0          0          0
  countsols        :          0          0          0          0          1          0          0          6          0          0          0          0          0          0          0
  components       :          0          0          0          0          0          0          0          0          0          0          0          0          0          0          0
Constraint Timings :  TotalTime  SetupTime   Separate  Propagate     EnfoLP     EnfoPS     EnfoRelax   Check    ResProp    SB-Prop
  benderslp        :       0.00       0.00       0.00       0.00       0.00       0.00       0.00       0.00       0.00       0.00
  integral         :       0.00       0.00       0.00       0.00       0.00       0.00       0.00       0.00       0.00       0.00
  varbound         :       0.00       0.00       0.00       0.00       0.00       0.00       0.00       0.00       0.00       0.00
  linear           :       0.01       0.01       0.00       0.00       0.00       0.00       0.00       0.00       0.00       0.00
  benders          :       0.00       0.00       0.00       0.00       0.00       0.00       0.00       0.00       0.00       0.00
  countsols        :       0.00       0.00       0.00       0.00       0.00       0.00       0.00       0.00       0.00       0.00
  components       :       0.00       0.00       0.00       0.00       0.00       0.00       0.00       0.00       0.00       0.00
Propagators        : #Propagate   #ResProp    Cutoffs    DomReds
  dualfix          :          4          0          0          0
  genvbounds       :          0          0          0          0
  nlobbt           :          0          0          0          0
  obbt             :          0          0          0          0
  probing          :          0          0          0          0
  pseudoobj        :         13          0          0          0
  redcost          :          8          0          0          1
  rootredcost      :          0          0          0          0
  symmetry         :          0          0          0          0
  vbounds          :         28          0          0          0
Propagator Timings :  TotalTime  SetupTime   Presolve  Propagate    ResProp    SB-Prop
  dualfix          :       0.00       0.00       0.00       0.00       0.00       0.00
  genvbounds       :       0.00       0.00       0.00       0.00       0.00       0.00
  nlobbt           :       0.00       0.00       0.00       0.00       0.00       0.00
  obbt             :       0.00       0.00       0.00       0.00       0.00       0.00
  probing          :       0.01       0.00       0.01       0.00       0.00       0.00
  pseudoobj        :       0.00       0.00       0.00       0.00       0.00       0.00
  redcost          :       0.00       0.00       0.00       0.00       0.00       0.00
  rootredcost      :       0.00       0.00       0.00       0.00       0.00       0.00
  symmetry         :       0.00       0.00       0.00       0.00       0.00       0.00
  vbounds          :       0.00       0.00       0.00       0.00       0.00       0.00
Conflict Analysis  :       Time      Calls    Success    DomReds  Conflicts   Literals    Reconvs ReconvLits   Dualrays   Nonzeros   LP Iters   (pool size: [--,--])
  propagation      :       0.00          0          0          -          0        0.0          0        0.0          -          -          -
  infeasible LP    :       0.00          0          0          -          0        0.0          0        0.0          0        0.0          0
  bound exceed. LP :       0.00          0          0          -          0        0.0          0        0.0          0        0.0          0
  strong branching :       0.00          0          0          -          0        0.0          0        0.0          -          -          0
  pseudo solution  :       0.00          0          0          -          0        0.0          0        0.0          -          -          -
  applied globally :       0.00          -          -          0          0        0.0          -          -          0          -          -
  applied locally  :          -          -          -          0          0        0.0          -          -          0          -          -
Separators         :   ExecTime  SetupTime      Calls    Cutoffs    DomReds       Cuts    Applied      Conss
  cut pool         :       0.00                     7          -          -          6          -          -    (maximal pool size: 13)
  aggregation      :       0.01       0.00          2          0          0          2          0          0
  cgmip            :       0.00       0.00          0          0          0          0          0          0
  clique           :       0.00       0.00          1          0          0          0          0          0
  closecuts        :       0.00       0.00          0          0          0          0          0          0
  cmir             :       0.00       0.00          0          0          0          0          0          0
  convexproj       :       0.00       0.00          0          0          0          0          0          0
  disjunctive      :       0.00       0.00          0          0          0          0          0          0
  eccuts           :       0.00       0.00          0          0          0          0          0          0
  flowcover        :       0.00       0.00          0          0          0          0          0          0
  gauge            :       0.00       0.00          0          0          0          0          0          0
  gomory           :       0.00       0.00          2          0          0          3          0          0
  impliedbounds    :       0.00       0.00          2          0          0          7          5          0
  intobj           :       0.00       0.00          0          0          0          0          0          0
  mcf              :       0.00       0.00          1          0          0          0          0          0
  oddcycle         :       0.00       0.00          0          0          0          0          0          0
  rapidlearning    :       0.00       0.00          0          0          0          0          0          0
  strongcg         :       0.00       0.00          2          0          0          0          0          0
  zerohalf         :       0.00       0.00          2          0          0          1          0          0
Pricers            :   ExecTime  SetupTime      Calls       Vars
  problem variables:       0.00          -          0          0
Branching Rules    :   ExecTime  SetupTime   BranchLP  BranchExt   BranchPS    Cutoffs    DomReds       Cuts      Conss   Children
  allfullstrong    :       0.00       0.00          0          0          0          0          0          0          0          0
  cloud            :       0.00       0.00          0          0          0          0          0          0          0          0
  distribution     :       0.00       0.00          0          0          0          0          0          0          0          0
  fullstrong       :       0.00       0.00          0          0          0          0          0          0          0          0
  inference        :       0.00       0.00          0          0          0          0          0          0          0          0
  leastinf         :       0.00       0.00          0          0          0          0          0          0          0          0
  lookahead        :       0.00       0.00          0          0          0          0          0          0          0          0
  mostinf          :       0.00       0.00          0          0          0          0          0          0          0          0
  multaggr         :       0.00       0.00          0          0          0          0          0          0          0          0
  nodereopt        :       0.00       0.00          0          0          0          0          0          0          0          0
  pscost           :       0.00       0.00          0          0          0          0          0          0          0          0
  random           :       0.00       0.00          0          0          0          0          0          0          0          0
  relpscost        :       0.00       0.00          0          0          0          0          0          0          0          0
  vanillafullstrong:       0.00       0.00          0          0          0          0          0          0          0          0
Primal Heuristics  :   ExecTime  SetupTime      Calls      Found       Best
  LP solutions     :       0.00          -          -          1          1
  relax solutions  :       0.00          -          -          0          0
  pseudo solutions :       0.00          -          -          0          0
  strong branching :       0.00          -          -          0          0
  actconsdiving    :       0.00       0.00          0          0          0
  adaptivediving   :       0.00       0.00          0          0          0
  alns             :       0.03       0.00          1          1          1
  bound            :       0.00       0.00          0          0          0
  clique           :       0.00       0.00          0          0          0
  coefdiving       :       0.00       0.00          0          0          0
  completesol      :       0.00       0.00          0          0          0
  conflictdiving   :       0.00       0.00          0          0          0
  crossover        :       0.00       0.00          0          0          0
  dins             :       0.00       0.00          0          0          0
  distributiondivin:       0.00       0.00          0          0          0
  dualval          :       0.00       0.00          0          0          0
  farkasdiving     :       0.00       0.00          0          0          0
  feaspump         :       0.00       0.00          0          0          0
  fixandinfer      :       0.00       0.00          0          0          0
  fracdiving       :       0.00       0.00          0          0          0
  gins             :       0.00       0.00          0          0          0
  guideddiving     :       0.00       0.00          0          0          0
  indicator        :       0.00       0.00          0          0          0
  intdiving        :       0.00       0.00          0          0          0
  intshifting      :       0.00       0.00          0          0          0
  linesearchdiving :       0.00       0.00          0          0          0
  localbranching   :       0.00       0.00          0          0          0
  locks            :       0.02       0.00          1          1          1
  lpface           :       0.00       0.00          0          0          0
  mpec             :       0.00       0.00          0          0          0
  multistart       :       0.00       0.00          0          0          0
  mutation         :       0.00       0.00          0          0          0
  nlpdiving        :       0.00       0.00          0          0          0
  objpscostdiving  :       0.00       0.00          0          0          0
  octane           :       0.00       0.00          0          0          0
  ofins            :       0.00       0.00          0          0          0
  oneopt           :       0.00       0.00          3          0          0
  padm             :       0.00       0.00          0          0          0
  proximity        :       0.00       0.00          0          0          0
  pscostdiving     :       0.00       0.00          0          0          0
  randrounding     :       0.00       0.00          2          1          1
  rens             :       0.00       0.00          0          0          0
  reoptsols        :       0.00       0.00          0          0          0
  repair           :       0.00       0.00          0          0          0
  rins             :       0.00       0.00          0          0          0
  rootsoldiving    :       0.00       0.00          0          0          0
  rounding         :       0.00       0.00          2          0          0
  shiftandpropagate:       0.00       0.00          0          0          0
  shifting         :       0.00       0.00          2          1          0
  simplerounding   :       0.00       0.00          0          0          0
  subnlp           :       0.00       0.00          0          0          0
  trivial          :       0.02       0.00          2          0          0
  trivialnegation  :       0.00       0.00          0          0          0
  trustregion      :       0.00       0.00          0          0          0
  trysol           :       0.00       0.00          0          0          0
  twoopt           :       0.00       0.00          0          0          0
  undercover       :       0.00       0.00          0          0          0
  vbounds          :       0.00       0.00          0          0          0
  veclendiving     :       0.00       0.00          0          0          0
  zeroobj          :       0.00       0.00          0          0          0
  zirounding       :       0.00       0.00          0          0          0
  other solutions  :          -          -          -          0          -
Diving (single)    :      Calls      Nodes   LP Iters Backtracks  Conflicts   MinDepth   MaxDepth   AvgDepth  RoundSols  NLeafSols  MinSolDpt  MaxSolDpt  AvgSolDpt
  actconsdiving    :          0          -          -          -          -          -          -          -          -          -          -          -          -
  coefdiving       :          0          -          -          -          -          -          -          -          -          -          -          -          -
  conflictdiving   :          0          -          -          -          -          -          -          -          -          -          -          -          -
  distributiondivin:          0          -          -          -          -          -          -          -          -          -          -          -          -
  farkasdiving     :          0          -          -          -          -          -          -          -          -          -          -          -          -
  fracdiving       :          0          -          -          -          -          -          -          -          -          -          -          -          -
  guideddiving     :          0          -          -          -          -          -          -          -          -          -          -          -          -
  linesearchdiving :          0          -          -          -          -          -          -          -          -          -          -          -          -
  pscostdiving     :          0          -          -          -          -          -          -          -          -          -          -          -          -
  veclendiving     :          0          -          -          -          -          -          -          -          -          -          -          -          -
Diving (adaptive)  :      Calls      Nodes   LP Iters Backtracks  Conflicts   MinDepth   MaxDepth   AvgDepth  RoundSols  NLeafSols  MinSolDpt  MaxSolDpt  AvgSolDpt
  actconsdiving    :          0          -          -          -          -          -          -          -          -          -          -          -          -
  coefdiving       :          0          -          -          -          -          -          -          -          -          -          -          -          -
  conflictdiving   :          0          -          -          -          -          -          -          -          -          -          -          -          -
  distributiondivin:          0          -          -          -          -          -          -          -          -          -          -          -          -
  farkasdiving     :          0          -          -          -          -          -          -          -          -          -          -          -          -
  fracdiving       :          0          -          -          -          -          -          -          -          -          -          -          -          -
  guideddiving     :          0          -          -          -          -          -          -          -          -          -          -          -          -
  linesearchdiving :          0          -          -          -          -          -          -          -          -          -          -          -          -
  pscostdiving     :          0          -          -          -          -          -          -          -          -          -          -          -          -
  veclendiving     :          0          -          -          -          -          -          -          -          -          -          -          -          -
Neighborhoods      :      Calls  SetupTime  SolveTime SolveNodes       Sols       Best       Exp3  EpsGreedy        UCB TgtFixRate  Opt  Inf Node Stal  Sol  Usr Othr Actv
  rens             :          0       0.00       0.00          0          0          0    0.00000   -1.00000    1.00000      0.900    0    0    0    0    0    0    0    1
  rins             :          0       0.00       0.00          0          0          0    0.00000   -1.00000    1.00000      0.900    0    0    0    0    0    0    0    1
  mutation         :          1       0.01       0.00          1          1          1    0.00000   -1.00000    1.00000      0.700    1    0    0    0    0    0    0    1
  localbranching   :          0       0.00       0.00          0          0          0    0.00000   -1.00000    1.00000      0.900    0    0    0    0    0    0    0    1
  crossover        :          0       0.00       0.00          0          0          0    0.00000   -1.00000    1.00000      0.900    0    0    0    0    0    0    0    1
  proximity        :          0       0.00       0.00          0          0          0    0.00000   -1.00000    1.00000      0.900    0    0    0    0    0    0    0    1
  zeroobjective    :          0       0.00       0.00          0          0          0    0.00000   -1.00000    1.00000      0.900    0    0    0    0    0    0    0    1
  dins             :          0       0.00       0.00          0          0          0    0.00000   -1.00000    1.00000      0.900    0    0    0    0    0    0    0    1
  trustregion      :          0       0.00       0.00          0          0          0    0.00000   -1.00000    1.00000      0.900    0    0    0    0    0    0    0    0
LP                 :       Time      Calls Iterations  Iter/call   Iter/sec  Time-0-It Calls-0-It    ItLimit
  primal LP        :       0.00          1          0       0.00          -       0.00          1
  dual LP          :       0.00          6         20       6.67          -       0.00          3
  lex dual LP      :       0.00          0          0       0.00          -
  barrier LP       :       0.00          0          0       0.00          -       0.00          0
  resolve instable :       0.00          0          0       0.00          -
  diving/probing LP:       0.01          1         16      16.00    1509.01
  strong branching :       0.00          0          0       0.00          -          -          -          0
    (at root node) :          -          0          0       0.00          -
  conflict analysis:       0.00          0          0       0.00          -
B&B Tree           :
  number of runs   :          1
  nodes            :          1 (0 internal, 1 leaves)
  feasible leaves  :          0
  infeas. leaves   :          0
  objective leaves :          0
  nodes (total)    :          1 (0 internal, 1 leaves)
  nodes left       :          0
  max depth        :          0
  max depth (total):          0
  backtracks       :          0 (0.0%)
  early backtracks :          0 (0.0%)
  nodes exc. ref.  :          0 (0.0%)
  delayed cutoffs  :          0
  repropagations   :          0 (0 domain reductions, 0 cutoffs)
  avg switch length:       2.00
  switching time   :       0.00
Estim. Tree Size   :          1
Estimation Tree    : 1 nodes (1 visited, 0 internal, 1 leaves, 0 open), weight: 1.0000 completed 1.0000
Estimations        :      estim      value      trend resolution     smooth
  wbe              :          1          -          -          -          -
  tree-profile     :         -1          -          -          -          -
  gap              :          1    1.00000    1.00000          1          1
  tree-weight      :          1    1.00000    1.00000          1          1
  leaf-frequency   :          1    0.50000    1.00000          1          1
  ssg              :          1    0.00000   -1.00000          1          1
  open-nodes       :          1    0.00000    0.00000          1          1
Root Node          :
  First LP value   : +3.56888967847063e+05
  First LP Iters   :         13 (105691.06 Iter/sec)
  First LP Time    :       0.00
  Final Dual Bound : +3.49105625543924e+05
  Final Root Iters :         20
  Root LP Estimate : +3.49105625543924e+05
Solution           :
  Solutions found  :          5 (4 improvements)
  First Solution   : +3.25236741109032e+05   (in run 1, after 1 nodes, 0.26 seconds, depth 14, found by <locks>)
  Gap First Sol.   :     352.28 %
  Gap Last Sol.    :       0.00 %
  Primal Bound     : +3.49105625543924e+05   (in run 1, after 1 nodes, 0.32 seconds, depth 0, found by <relaxation>)
  Dual Bound       : +3.49105625543924e+05
  Gap              :       0.00 %
Integrals          :      Total       Avg%
  primal-dual      :      26.81      83.67
  primal-ref       :          -          - (not evaluated)
  dual-ref         :          -          - (not evaluated)
