SCIP version 7.0.2 [precision: 8 byte] [memory: block] [mode: optimized] [LP solver: SoPlex 5.0.2] [GitHash: dafb536cfd]
Copyright (C) 2002-2020 Konrad-Zuse-Zentrum fuer Informationstechnik Berlin (ZIB)

External codes: 
  Readline 7.0         GNU library for command line editing (gnu.org/s/readline)
  SoPlex 5.0.2         Linear Programming Solver developed at Zuse Institute Berlin (soplex.zib.de) [GitHash: 3623dbc0]
  CppAD 20180000.0     Algorithmic Differentiation of C++ algorithms developed by B. Bell (www.coin-or.org/CppAD)
  ZLIB 1.2.11          General purpose compression library by J. Gailly and M. Adler (zlib.net)
  GMP 6.1.2            GNU Multiple Precision Arithmetic Library developed by T. Granlund (gmplib.org)
  ZIMPL 3.4.0          Zuse Institute Mathematical Programming Language developed by T. Koch (zimpl.zib.de)
  PaPILO 1.0.1         parallel presolve for integer and linear optimization (https://github.com/lgottwald/PaPILO) [GitHash: 0638fc4]
  bliss 0.73p          Computing Graph Automorphism Groups by T. Junttila and P. Kaski (http://www.tcs.hut.fi/Software/bliss/)
  Ipopt 3.13.2         Interior Point Optimizer developed by A. Waechter et.al. (www.coin-or.org/Ipopt)

user parameter file <scip.set> not found - using default parameters

read problem <model_strategy_1eng.zpl>
============


base directory for ZIMPL parsing: </workspace>

original problem has 21449 variables (24 bin, 0 int, 0 impl, 21425 cont) and 31109 constraints

solve problem
=============

presolving:
(round 1, fast)       12356 del vars, 13939 del conss, 0 add conss, 16535 chg bounds, 0 chg sides, 0 chg coeffs, 0 upgd conss, 0 impls, 0 clqs
(round 2, fast)       21323 del vars, 30821 del conss, 0 add conss, 25564 chg bounds, 2 chg sides, 6 chg coeffs, 0 upgd conss, 0 impls, 0 clqs
(round 3, fast)       21330 del vars, 30972 del conss, 0 add conss, 25567 chg bounds, 3 chg sides, 7 chg coeffs, 0 upgd conss, 0 impls, 0 clqs
(round 4, fast)       21330 del vars, 30972 del conss, 0 add conss, 25576 chg bounds, 6 chg sides, 8 chg coeffs, 0 upgd conss, 0 impls, 0 clqs
(round 5, fast)       21330 del vars, 30972 del conss, 0 add conss, 25577 chg bounds, 6 chg sides, 10 chg coeffs, 0 upgd conss, 0 impls, 0 clqs
   (0.2s) running MILP presolver
   (0.2s) MILP presolver (7 rounds): 41 aggregations, 7 fixings, 0 bound changes
(round 6, medium)     21378 del vars, 31109 del conss, 61 add conss, 25577 chg bounds, 6 chg sides, 10 chg coeffs, 0 upgd conss, 0 impls, 0 clqs
(round 7, fast)       21381 del vars, 31109 del conss, 61 add conss, 25577 chg bounds, 6 chg sides, 10 chg coeffs, 0 upgd conss, 0 impls, 0 clqs
(round 8, fast)       21381 del vars, 31109 del conss, 61 add conss, 25577 chg bounds, 9 chg sides, 10 chg coeffs, 0 upgd conss, 0 impls, 0 clqs
(round 9, fast)       21384 del vars, 31109 del conss, 61 add conss, 25577 chg bounds, 9 chg sides, 10 chg coeffs, 0 upgd conss, 0 impls, 0 clqs
(round 10, exhaustive) 21384 del vars, 31136 del conss, 61 add conss, 25577 chg bounds, 36 chg sides, 10 chg coeffs, 0 upgd conss, 0 impls, 0 clqs
(round 11, fast)       21386 del vars, 31136 del conss, 61 add conss, 25577 chg bounds, 36 chg sides, 10 chg coeffs, 0 upgd conss, 0 impls, 0 clqs
(round 12, fast)       21386 del vars, 31136 del conss, 61 add conss, 25577 chg bounds, 38 chg sides, 10 chg coeffs, 0 upgd conss, 0 impls, 0 clqs
(round 13, fast)       21389 del vars, 31136 del conss, 61 add conss, 25577 chg bounds, 38 chg sides, 10 chg coeffs, 0 upgd conss, 0 impls, 0 clqs
   (0.2s) running MILP presolver
   (0.2s) MILP presolver (4 rounds): 6 aggregations, 10 fixings, 0 bound changes
(round 14, medium)     21405 del vars, 31136 del conss, 61 add conss, 25577 chg bounds, 38 chg sides, 10 chg coeffs, 0 upgd conss, 0 impls, 0 clqs
(round 15, fast)       21405 del vars, 31142 del conss, 61 add conss, 25577 chg bounds, 38 chg sides, 10 chg coeffs, 0 upgd conss, 0 impls, 0 clqs
   (0.2s) probing cycle finished: starting next cycle
   (0.2s) symmetry computation started: requiring (bin +, int -, cont +), (fixed: bin -, int +, cont -)
   (0.2s) no symmetry present
presolving (16 rounds: 16 fast, 4 medium, 2 exhaustive):
 21405 deleted vars, 31142 deleted constraints, 61 added constraints, 25577 tightened bounds, 0 added holes, 38 changed sides, 10 changed coefficients
 28 implications, 0 cliques
presolved problem has 44 variables (10 bin, 0 int, 0 impl, 34 cont) and 28 constraints
     28 constraints of type <linear>
Presolving Time: 0.17

 time | node  | left  |LP iter|LP it/n|mem/heur|mdpt |vars |cons |rows |cuts |sepa|confs|strbr|  dualbound   | primalbound  |  gap   | compl. 
p 0.3s|     1 |     0 |    16 |     - |   locks|   0 |  44 |  28 |  28 |   0 |  0 |   0 |   0 | 2.324841e+06 | 2.010399e+05 |1056.41%| unknown
  0.3s|     1 |     0 |    27 |     - |    85M |   0 |  44 |  28 |  28 |   0 |  0 |   0 |   0 | 2.262507e+05 | 2.010399e+05 |  12.54%| unknown
  0.3s|     1 |     0 |    29 |     - |    85M |   0 |  44 |  28 |  30 |   2 |  1 |   0 |   0 | 2.228165e+05 | 2.010399e+05 |  10.83%| unknown
r 0.3s|     1 |     0 |    29 |     - |randroun|   0 |  44 |  28 |  30 |   0 |  1 |   0 |   0 | 2.228165e+05 | 2.209865e+05 |   0.83%| unknown
  0.3s|     1 |     0 |    31 |     - |    85M |   0 |  44 |  28 |  31 |   3 |  2 |   0 |   0 | 2.216146e+05 | 2.209865e+05 |   0.28%| unknown
  0.3s|     1 |     0 |    31 |     - |    86M |   0 |  44 |  28 |  25 |   3 |  2 |   0 |   0 | 2.216146e+05 | 2.209865e+05 |   0.28%| unknown
  0.3s|     1 |     0 |    31 |     - |    86M |   0 |  44 |  15 |  25 |   3 |  4 |   0 |   0 | 2.216146e+05 | 2.209865e+05 |   0.28%| unknown
L 0.3s|     1 |     0 |    31 |     - |    alns|   0 |  44 |  15 |  25 |   3 |  6 |   0 |   0 | 2.216146e+05 | 2.216146e+05 |   0.00%| unknown
  0.3s|     1 |     0 |    31 |     - |    86M |   0 |  44 |  15 |  25 |   3 |  6 |   0 |   0 | 2.216146e+05 | 2.216146e+05 |   0.00%| unknown

SCIP Status        : problem is solved [optimal solution found]
Solving Time (sec) : 0.30
Solving Nodes      : 1
Primal Bound       : +2.21614565634427e+05 (4 solutions)
Dual Bound         : +2.21614565634427e+05
Gap                : 0.00 %

primal solution (original space):
=================================

objective value:                     221614.565634427
s#1                                                 1 	(obj:-3660)
s#14                                                1 	(obj:-3660)
s#23                                                1 	(obj:-3660)
x#1#7#1                                           252 	(obj:-10.2748178018611)
x#1#7#2                                           258 	(obj:-10.2748178018611)
x#1#8#1                                           253 	(obj:-11.150896735415)
x#1#8#2                                           274 	(obj:-11.150896735415)
x#1#61#3                                          536 	(obj:-4.62235649546828)
x#2#62#3                                          536 	(obj:-4.62235649546828)
x#3#63#3                                          536 	(obj:-4.62235649546828)
x#4#64#3                                          536 	(obj:-4.62235649546828)
x#5#65#3                                          536 	(obj:-4.62235649546828)
x#6#66#3                                          536 	(obj:-4.62235649546828)
x#7#0#1                                        230.48 	(obj:-45.9802844510504)
x#7#0#2                                        230.48 	(obj:-45.9802844510504)
x#7#67#3                                          536 	(obj:-4.62235649546828)
x#8#1#1                                        230.48 	(obj:-5.24254779799416)
x#8#1#2                                        230.48 	(obj:-5.24254779799416)
x#8#68#3                                          536 	(obj:-4.62235649546828)
x#9#2#1                                        230.48 	(obj:-6.05421092486207)
x#9#2#2                                        230.48 	(obj:-6.05421092486207)
x#9#69#3                                          536 	(obj:-4.62235649546828)
x#10#3#1                                       230.48 	(obj:-6.87550949817744)
x#10#3#2                                       230.48 	(obj:-6.87550949817744)
x#10#70#3                                         536 	(obj:-4.62235649546828)
x#11#4#1                                       230.48 	(obj:-7.70746468295299)
x#11#4#2                                       230.48 	(obj:-7.70746468295299)
x#11#71#3                                         536 	(obj:-4.62235649546828)
x#12#5#1                                       230.48 	(obj:-8.55109764420144)
x#12#5#2                                       230.48 	(obj:-8.55109764420144)
x#12#72#3                                         536 	(obj:-4.62235649546828)
x#13#6#1                                       230.48 	(obj:-9.4074295469355)
x#13#6#2                                       230.48 	(obj:-9.4074295469355)
x#13#73#3                                         536 	(obj:-4.62235649546828)
x#14#7#1                                       230.48 	(obj:-10.2748178018611)
x#14#7#2                                       230.48 	(obj:-10.2748178018611)
x#14#74#3                                         536 	(obj:-4.62235649546828)
x#15#8#2                                       230.48 	(obj:-11.150896735415)
x#15#75#3                                         536 	(obj:-4.62235649546828)
x#16#9#2                                       230.48 	(obj:-12.0356028862058)
x#16#76#3                                         536 	(obj:-4.62235649546828)
x#17#10#2                                      230.48 	(obj:-12.9288727928426)
x#17#77#3                                         536 	(obj:-4.62235649546828)
x#18#11#2                                      230.48 	(obj:-13.8306429939341)
x#18#78#3                                         536 	(obj:-4.62235649546828)
x#19#0#1                                       230.48 	(obj:-45.9802844510504)
x#19#0#2                                       230.48 	(obj:-45.9802844510504)
x#19#12#2                                      230.48 	(obj:-14.7408500280891)
x#19#79#3                                         536 	(obj:-4.62235649546828)
x#20#1#1                                       230.48 	(obj:-5.24254779799416)
x#20#1#2                                       230.48 	(obj:-5.24254779799416)
x#20#13#2                                      230.48 	(obj:-15.6594304339164)
x#20#80#3                                         536 	(obj:-4.62235649546828)
x#21#2#1                                       230.48 	(obj:-6.05421092486207)
x#21#2#2                                       230.48 	(obj:-6.05421092486207)
x#21#14#2                                      230.48 	(obj:-16.5863207500249)
x#21#81#3                                         536 	(obj:-4.62235649546828)
x#22#3#1                                       230.48 	(obj:-6.87550949817744)
x#22#3#2                                       230.48 	(obj:-6.87550949817744)
x#22#15#2                                      230.48 	(obj:-17.5214575150235)
x#22#82#3                                         536 	(obj:-4.62235649546828)
x#23#4#1                                       230.48 	(obj:-7.70746468295299)
x#23#4#2                                       230.48 	(obj:-7.70746468295299)
x#23#16#2                                      230.48 	(obj:-18.4647772675209)
x#23#83#3                                         536 	(obj:-4.62235649546828)
x#24#5#1                                       230.48 	(obj:-8.55109764420144)
x#24#5#2                                       230.48 	(obj:-8.55109764420144)
x#24#84#3                                         536 	(obj:-4.62235649546828)
x#0#6#1                                           252 	(obj:0)
x#0#6#2                                           258 	(obj:0)
x#0#7#1                                           253 	(obj:0)
x#0#7#2                                           274 	(obj:0)
x#0#60#3                                          536 	(obj:0)
y#1#7#1                                           252 	(obj:249)
y#1#7#2                                           258 	(obj:249)
y#1#8#1                                           253 	(obj:249)
y#1#8#2                                           274 	(obj:249)
y#14#7#1                                       230.48 	(obj:255)
y#23#16#2                                      230.48 	(obj:434)
n#7#1                                          230.48 	(obj:0)
n#7#2                                          230.48 	(obj:0)
n#19#1                                         230.48 	(obj:0)
n#19#2                                         230.48 	(obj:0)

Statistics
==========

SCIP Status        : problem is solved [optimal solution found]
Total Time         :       0.79
  solving          :       0.30
  presolving       :       0.17 (included in solving)
  reading          :       0.49
  copying          :       0.01 (1 #copies) (minimal 0.01, maximal 0.01, average 0.01)
Original Problem   :
  Problem name     : model_strategy_1eng.zpl
  Variables        : 21449 (24 binary, 0 integer, 0 implicit integer, 21425 continuous)
  Constraints      : 31109 initial, 31109 maximal
  Objective        : maximize, 10503 non-zeros (abs.min = 4.62236, abs.max = 3660)
Presolved Problem  :
  Problem name     : t_model_strategy_1eng.zpl
  Variables        : 44 (10 binary, 0 integer, 0 implicit integer, 34 continuous)
  Constraints      : 28 initial, 28 maximal
  Objective        : minimize, 44 non-zeros (abs.min = 26.4012, abs.max = 3660)
  Nonzeros         : 116 constraint, 0 clique table
Presolvers         :   ExecTime  SetupTime  Calls  FixedVars   AggrVars   ChgTypes  ChgBounds   AddHoles    DelCons    AddCons   ChgSides   ChgCoefs
  boundshift       :       0.00       0.00      0          0          0          0          0          0          0          0          0          0
  convertinttobin  :       0.00       0.00      0          0          0          0          0          0          0          0          0          0
  domcol           :       0.00       0.00      1          0          0          0          0          0          0          0          0          0
  dualagg          :       0.00       0.00      0          0          0          0          0          0          0          0          0          0
  dualcomp         :       0.00       0.00      1          0          0          0          0          0          0          0          0          0
  dualinfer        :       0.00       0.00      0          0          0          0          0          0          0          0          0          0
  dualsparsify     :       0.00       0.00      1          0          0          0          0          0          0          0          0          0
  gateextraction   :       0.00       0.00      0          0          0          0          0          0          0          0          0          0
  implics          :       0.00       0.00      4          0          0          0          0          0          0          0          0          0
  inttobinary      :       0.00       0.00      0          0          0          0          0          0          0          0          0          0
  milp             :       0.03       0.00      2         17         47          0          0          0        137         61          0          0
  qpkktref         :       0.00       0.00      0          0          0          0          0          0          0          0          0          0
  redvub           :       0.00       0.00      0          0          0          0          0          0          0          0          0          0
  sparsify         :       0.00       0.00      1          0          0          0          0          0          0          0          0          0
  stuffing         :       0.00       0.00      0          0          0          0          0          0          0          0          0          0
  trivial          :       0.00       0.00     16          0          0          0          0          0          0          0          0          0
  tworowbnd        :       0.00       0.00      0          0          0          0          0          0          0          0          0          0
  dualfix          :       0.00       0.00     16         12          0          0          0          0          0          0          0          0
  genvbounds       :       0.00       0.00      0          0          0          0          0          0          0          0          0          0
  probing          :       0.01       0.00      1          0          0          0          0          0          0          0          0          0
  pseudoobj        :       0.00       0.00      0          0          0          0          0          0          0          0          0          0
  symmetry         :       0.00       0.00      1          0          0          0          0          0          0          0          0          0
  vbounds          :       0.00       0.00      0          0          0          0          0          0          0          0          0          0
  linear           :       0.09       0.01     18      19509       1820          0      25577          0      31005          0         38         10
  benders          :       0.00       0.00      0          0          0          0          0          0          0          0          0          0
  components       :       0.00       0.00      1          0          0          0          0          0          0          0          0          0
  root node        :          -          -      -          6          -          -         22          -          -          -          -          -
Constraints        :     Number  MaxNumber  #Separate #Propagate    #EnfoLP    #EnfoRelax  #EnfoPS    #Check   #ResProp    Cutoffs    DomReds       Cuts    Applied      Conss   Children
  benderslp        :          0          0          0          0          0          0          0         15          0          0          0          0          0          0          0
  integral         :          0          0          0          0          0          0          0         15          0          0          0          0          0          0          0
  linear           :         28         28          4         49          0          0          0          9          0          0         16          0          0          0          0
  benders          :          0          0          0          0          0          0          0          5          0          0          0          0          0          0          0
  countsols        :          0          0          0          0          0          0          0          5          0          0          0          0          0          0          0
  components       :          0          0          0          0          0          0          0          0          0          0          0          0          0          0          0
Constraint Timings :  TotalTime  SetupTime   Separate  Propagate     EnfoLP     EnfoPS     EnfoRelax   Check    ResProp    SB-Prop
  benderslp        :       0.00       0.00       0.00       0.00       0.00       0.00       0.00       0.00       0.00       0.00
  integral         :       0.00       0.00       0.00       0.00       0.00       0.00       0.00       0.00       0.00       0.00
  linear           :       0.01       0.01       0.00       0.00       0.00       0.00       0.00       0.00       0.00       0.00
  benders          :       0.00       0.00       0.00       0.00       0.00       0.00       0.00       0.00       0.00       0.00
  countsols        :       0.00       0.00       0.00       0.00       0.00       0.00       0.00       0.00       0.00       0.00
  components       :       0.00       0.00       0.00       0.00       0.00       0.00       0.00       0.00       0.00       0.00
Propagators        : #Propagate   #ResProp    Cutoffs    DomReds
  dualfix          :          4          0          0          0
  genvbounds       :          0          0          0          0
  nlobbt           :          0          0          0          0
  obbt             :          0          0          0          0
  probing          :          0          0          0          0
  pseudoobj        :         11          0          0          0
  redcost          :          6          0          0          6
  rootredcost      :          0          0          0          0
  symmetry         :          0          0          0          0
  vbounds          :         20          0          0          0
Propagator Timings :  TotalTime  SetupTime   Presolve  Propagate    ResProp    SB-Prop
  dualfix          :       0.00       0.00       0.00       0.00       0.00       0.00
  genvbounds       :       0.00       0.00       0.00       0.00       0.00       0.00
  nlobbt           :       0.00       0.00       0.00       0.00       0.00       0.00
  obbt             :       0.00       0.00       0.00       0.00       0.00       0.00
  probing          :       0.01       0.00       0.01       0.00       0.00       0.00
  pseudoobj        :       0.00       0.00       0.00       0.00       0.00       0.00
  redcost          :       0.00       0.00       0.00       0.00       0.00       0.00
  rootredcost      :       0.00       0.00       0.00       0.00       0.00       0.00
  symmetry         :       0.00       0.00       0.00       0.00       0.00       0.00
  vbounds          :       0.00       0.00       0.00       0.00       0.00       0.00
Conflict Analysis  :       Time      Calls    Success    DomReds  Conflicts   Literals    Reconvs ReconvLits   Dualrays   Nonzeros   LP Iters   (pool size: [--,--])
  propagation      :       0.00          0          0          -          0        0.0          0        0.0          -          -          -
  infeasible LP    :       0.00          0          0          -          0        0.0          0        0.0          0        0.0          0
  bound exceed. LP :       0.00          0          0          -          0        0.0          0        0.0          0        0.0          0
  strong branching :       0.00          0          0          -          0        0.0          0        0.0          -          -          0
  pseudo solution  :       0.00          0          0          -          0        0.0          0        0.0          -          -          -
  applied globally :       0.00          -          -          0          0        0.0          -          -          0          -          -
  applied locally  :          -          -          -          0          0        0.0          -          -          0          -          -
Separators         :   ExecTime  SetupTime      Calls    Cutoffs    DomReds       Cuts    Applied      Conss
  cut pool         :       0.00                     5          -          -          3          -          -    (maximal pool size: 5)
  aggregation      :       0.00       0.00          2          0          0          0          0          0
  cgmip            :       0.00       0.00          0          0          0          0          0          0
  clique           :       0.00       0.00          1          0          0          0          0          0
  closecuts        :       0.00       0.00          0          0          0          0          0          0
  cmir             :       0.00       0.00          0          0          0          0          0          0
  convexproj       :       0.00       0.00          0          0          0          0          0          0
  disjunctive      :       0.00       0.00          0          0          0          0          0          0
  eccuts           :       0.00       0.00          0          0          0          0          0          0
  flowcover        :       0.00       0.00          0          0          0          0          0          0
  gauge            :       0.00       0.00          0          0          0          0          0          0
  gomory           :       0.00       0.00          2          0          0          2          0          0
  impliedbounds    :       0.00       0.00          2          0          0          3          3          0
  intobj           :       0.00       0.00          0          0          0          0          0          0
  mcf              :       0.00       0.00          1          0          0          0          0          0
  oddcycle         :       0.00       0.00          0          0          0          0          0          0
  rapidlearning    :       0.00       0.00          0          0          0          0          0          0
  strongcg         :       0.00       0.00          2          0          0          0          0          0
  zerohalf         :       0.00       0.00          2          0          0          0          0          0
Pricers            :   ExecTime  SetupTime      Calls       Vars
  problem variables:       0.00          -          0          0
Branching Rules    :   ExecTime  SetupTime   BranchLP  BranchExt   BranchPS    Cutoffs    DomReds       Cuts      Conss   Children
  allfullstrong    :       0.00       0.00          0          0          0          0          0          0          0          0
  cloud            :       0.00       0.00          0          0          0          0          0          0          0          0
  distribution     :       0.00       0.00          0          0          0          0          0          0          0          0
  fullstrong       :       0.00       0.00          0          0          0          0          0          0          0          0
  inference        :       0.00       0.00          0          0          0          0          0          0          0          0
  leastinf         :       0.00       0.00          0          0          0          0          0          0          0          0
  lookahead        :       0.00       0.00          0          0          0          0          0          0          0          0
  mostinf          :       0.00       0.00          0          0          0          0          0          0          0          0
  multaggr         :       0.00       0.00          0          0          0          0          0          0          0          0
  nodereopt        :       0.00       0.00          0          0          0          0          0          0          0          0
  pscost           :       0.00       0.00          0          0          0          0          0          0          0          0
  random           :       0.00       0.00          0          0          0          0          0          0          0          0
  relpscost        :       0.00       0.00          0          0          0          0          0          0          0          0
  vanillafullstrong:       0.00       0.00          0          0          0          0          0          0          0          0
Primal Heuristics  :   ExecTime  SetupTime      Calls      Found       Best
  LP solutions     :       0.00          -          -          0          0
  relax solutions  :       0.00          -          -          0          0
  pseudo solutions :       0.00          -          -          0          0
  strong branching :       0.00          -          -          0          0
  actconsdiving    :       0.00       0.00          0          0          0
  adaptivediving   :       0.00       0.00          0          0          0
  alns             :       0.02       0.00          1          1          1
  bound            :       0.00       0.00          0          0          0
  clique           :       0.00       0.00          0          0          0
  coefdiving       :       0.00       0.00          0          0          0
  completesol      :       0.00       0.00          0          0          0
  conflictdiving   :       0.00       0.00          0          0          0
  crossover        :       0.00       0.00          0          0          0
  dins             :       0.00       0.00          0          0          0
  distributiondivin:       0.00       0.00          0          0          0
  dualval          :       0.00       0.00          0          0          0
  farkasdiving     :       0.00       0.00          0          0          0
  feaspump         :       0.00       0.00          0          0          0
  fixandinfer      :       0.00       0.00          0          0          0
  fracdiving       :       0.00       0.00          0          0          0
  gins             :       0.00       0.00          0          0          0
  guideddiving     :       0.00       0.00          0          0          0
  indicator        :       0.00       0.00          0          0          0
  intdiving        :       0.00       0.00          0          0          0
  intshifting      :       0.00       0.00          0          0          0
  linesearchdiving :       0.00       0.00          0          0          0
  localbranching   :       0.00       0.00          0          0          0
  locks            :       0.02       0.00          1          1          1
  lpface           :       0.00       0.00          0          0          0
  mpec             :       0.00       0.00          0          0          0
  multistart       :       0.00       0.00          0          0          0
  mutation         :       0.00       0.00          0          0          0
  nlpdiving        :       0.00       0.00          0          0          0
  objpscostdiving  :       0.00       0.00          0          0          0
  octane           :       0.00       0.00          0          0          0
  ofins            :       0.00       0.00          0          0          0
  oneopt           :       0.00       0.00          2          0          0
  padm             :       0.00       0.00          0          0          0
  proximity        :       0.00       0.00          0          0          0
  pscostdiving     :       0.00       0.00          0          0          0
  randrounding     :       0.00       0.00          2          1          1
  rens             :       0.00       0.00          0          0          0
  reoptsols        :       0.00       0.00          0          0          0
  repair           :       0.00       0.00          0          0          0
  rins             :       0.00       0.00          0          0          0
  rootsoldiving    :       0.00       0.00          0          0          0
  rounding         :       0.00       0.00          2          0          0
  shiftandpropagate:       0.00       0.00          0          0          0
  shifting         :       0.00       0.00          2          1          0
  simplerounding   :       0.00       0.00          0          0          0
  subnlp           :       0.00       0.00          0          0          0
  trivial          :       0.03       0.00          2          0          0
  trivialnegation  :       0.00       0.00          0          0          0
  trustregion      :       0.00       0.00          0          0          0
  trysol           :       0.00       0.00          0          0          0
  twoopt           :       0.00       0.00          0          0          0
  undercover       :       0.00       0.00          0          0          0
  vbounds          :       0.00       0.00          0          0          0
  veclendiving     :       0.00       0.00          0          0          0
  zeroobj          :       0.00       0.00          0          0          0
  zirounding       :       0.00       0.00          0          0          0
  other solutions  :          -          -          -          0          -
Diving (single)    :      Calls      Nodes   LP Iters Backtracks  Conflicts   MinDepth   MaxDepth   AvgDepth  RoundSols  NLeafSols  MinSolDpt  MaxSolDpt  AvgSolDpt
  actconsdiving    :          0          -          -          -          -          -          -          -          -          -          -          -          -
  coefdiving       :          0          -          -          -          -          -          -          -          -          -          -          -          -
  conflictdiving   :          0          -          -          -          -          -          -          -          -          -          -          -          -
  distributiondivin:          0          -          -          -          -          -          -          -          -          -          -          -          -
  farkasdiving     :          0          -          -          -          -          -          -          -          -          -          -          -          -
  fracdiving       :          0          -          -          -          -          -          -          -          -          -          -          -          -
  guideddiving     :          0          -          -          -          -          -          -          -          -          -          -          -          -
  linesearchdiving :          0          -          -          -          -          -          -          -          -          -          -          -          -
  pscostdiving     :          0          -          -          -          -          -          -          -          -          -          -          -          -
  veclendiving     :          0          -          -          -          -          -          -          -          -          -          -          -          -
Diving (adaptive)  :      Calls      Nodes   LP Iters Backtracks  Conflicts   MinDepth   MaxDepth   AvgDepth  RoundSols  NLeafSols  MinSolDpt  MaxSolDpt  AvgSolDpt
  actconsdiving    :          0          -          -          -          -          -          -          -          -          -          -          -          -
  coefdiving       :          0          -          -          -          -          -          -          -          -          -          -          -          -
  conflictdiving   :          0          -          -          -          -          -          -          -          -          -          -          -          -
  distributiondivin:          0          -          -          -          -          -          -          -          -          -          -          -          -
  farkasdiving     :          0          -          -          -          -          -          -          -          -          -          -          -          -
  fracdiving       :          0          -          -          -          -          -          -          -          -          -          -          -          -
  guideddiving     :          0          -          -          -          -          -          -          -          -          -          -          -          -
  linesearchdiving :          0          -          -          -          -          -          -          -          -          -          -          -          -
  pscostdiving     :          0          -          -          -          -          -          -          -          -          -          -          -          -
  veclendiving     :          0          -          -          -          -          -          -          -          -          -          -          -          -
Neighborhoods      :      Calls  SetupTime  SolveTime SolveNodes       Sols       Best       Exp3  EpsGreedy        UCB TgtFixRate  Opt  Inf Node Stal  Sol  Usr Othr Actv
  rens             :          1       0.01       0.00          1          1          1    0.00000   -1.00000    1.00000      0.700    1    0    0    0    0    0    0    1
  rins             :          0       0.00       0.00          0          0          0    0.00000   -1.00000    1.00000      0.900    0    0    0    0    0    0    0    1
  mutation         :          0       0.00       0.00          0          0          0    0.00000   -1.00000    1.00000      0.900    0    0    0    0    0    0    0    1
  localbranching   :          0       0.00       0.00          0          0          0    0.00000   -1.00000    1.00000      0.900    0    0    0    0    0    0    0    1
  crossover        :          0       0.00       0.00          0          0          0    0.00000   -1.00000    1.00000      0.900    0    0    0    0    0    0    0    1
  proximity        :          0       0.00       0.00          0          0          0    0.00000   -1.00000    1.00000      0.900    0    0    0    0    0    0    0    1
  zeroobjective    :          0       0.00       0.00          0          0          0    0.00000   -1.00000    1.00000      0.900    0    0    0    0    0    0    0    1
  dins             :          0       0.00       0.00          0          0          0    0.00000   -1.00000    1.00000      0.900    0    0    0    0    0    0    0    1
  trustregion      :          0       0.00       0.00          0          0          0    0.00000   -1.00000    1.00000      0.900    0    0    0    0    0    0    0    0
LP                 :       Time      Calls Iterations  Iter/call   Iter/sec  Time-0-It Calls-0-It    ItLimit
  primal LP        :       0.00          0          0       0.00          -       0.00          0
  dual LP          :       0.00          5         15       5.00          -       0.00          2
  lex dual LP      :       0.00          0          0       0.00          -
  barrier LP       :       0.00          0          0       0.00          -       0.00          0
  resolve instable :       0.00          0          0       0.00          -
  diving/probing LP:       0.01          1         16      16.00    1474.79
  strong branching :       0.00          0          0       0.00          -          -          -          0
    (at root node) :          -          0          0       0.00          -
  conflict analysis:       0.00          0          0       0.00          -
B&B Tree           :
  number of runs   :          1
  nodes            :          1 (0 internal, 1 leaves)
  feasible leaves  :          0
  infeas. leaves   :          0
  objective leaves :          0
  nodes (total)    :          1 (0 internal, 1 leaves)
  nodes left       :          0
  max depth        :          0
  max depth (total):          0
  backtracks       :          0 (0.0%)
  early backtracks :          0 (0.0%)
  nodes exc. ref.  :          0 (0.0%)
  delayed cutoffs  :          0
  repropagations   :          0 (0 domain reductions, 0 cutoffs)
  avg switch length:       2.00
  switching time   :       0.00
Estim. Tree Size   :          1
Estimation Tree    : 1 nodes (1 visited, 0 internal, 1 leaves, 0 open), weight: 1.0000 completed 1.0000
Estimations        :      estim      value      trend resolution     smooth
  wbe              :          1          -          -          -          -
  tree-profile     :         -1          -          -          -          -
  gap              :          1    1.00000    1.00000          1          1
  tree-weight      :          1    1.00000    1.00000          1          1
  leaf-frequency   :          1    0.50000    1.00000          1          1
  ssg              :          1    0.00000   -1.00000          1          1
  open-nodes       :          1    0.00000    0.00000          1          1
Root Node          :
  First LP value   : +2.26250728636978e+05
  First LP Iters   :         11 (85271.32 Iter/sec)
  First LP Time    :       0.00
  Final Dual Bound : +2.21614565634427e+05
  Final Root Iters :         15
  Root LP Estimate :                     -
Solution           :
  Solutions found  :          4 (3 improvements)
  First Solution   : +2.01039909529104e+05   (in run 1, after 1 nodes, 0.25 seconds, depth 11, found by <locks>)
  Gap First Sol.   :    1056.41 %
  Gap Last Sol.    :       0.00 %
  Primal Bound     : +2.21614565634427e+05   (in run 1, after 1 nodes, 0.29 seconds, depth 0, found by <alns>)
  Dual Bound       : +2.21614565634427e+05
  Gap              :       0.00 %
Integrals          :      Total       Avg%
  primal-dual      :      25.57      85.10
  primal-ref       :          -          - (not evaluated)
  dual-ref         :          -          - (not evaluated)
